course_id,text,filtered_text,count,text_vi
C_948433,双脚与肩同宽前侧腿屈膝可以在手上拿一个哑铃将双手举高过于头顶之末端然后进行肩关节屈伸的振荡原理就是将肩部交替做紧绷储能和释放能量的动作,双脚肩同宽前侧腿屈膝手上哑铃双手举高过于头顶末端进行肩关节屈伸振荡原理肩部交替紧绷储能释放能量动作,4.0,"Hai chân dang rộng bằng vai và gập chân trước, bạn có thể cầm một quả tạ trên tay, giơ hai tay lên trên đỉnh đầu rồi thực hiện động tác gập và duỗi khớp vai. Nguyên tắc dao động là luân phiên siết chặt cơ. vai để lưu trữ và giải phóng năng lượng."
C_948433,实时关注运动状态把握度要拿好,实时关注运动状态把握度要,1.0,Hãy chú ý đến trạng thái thể thao của bạn trong thời gian thực và chắc chắn về điều đó
C_948433,闭眼减小支撑面在不稳定平面运动,闭眼减小支撑面在稳定平面运动,1.0,Nhắm mắt lại để giảm chuyển động của bề mặt đỡ trên mặt phẳng không ổn định
C_948433,运动性腹痛是指由体育运动中引起的腹部疼痛常在跑步中发生主要是在运动前准备活动不充分身体状况不好或腹部受凉使脏腑功能失调也有因为呼吸节奏紊乱或者是运动前准备活动不充分运动前饮食过保喝了大量的水或碳酸性饮料吃了有刺激性难消化的食物或者空腹运动处理办法减慢跑步速度弯腰慢跑一段时间可缓解疼痛如疼痛不减轻应停止运动必要时可服用十滴水或按揉相关穴位如仍不见好转去医院诊治排除腹内或腹腔外疾病,引起 发生 准备 受凉 失调 呼吸 紊乱 准备 保喝 吃 难 处理 减慢 弯腰 慢跑 缓解 减轻 应 停止 揉 相关 不见 好转 诊治 排除,1.0,"Đau bụng do tập thể dục là tình trạng đau bụng do chơi thể thao, thường xảy ra khi chạy. Nguyên nhân chủ yếu là do không chuẩn bị đầy đủ trước khi tập thể dục, thể chất kém hoặc đau bụng do lạnh, cũng có thể do rối loạn chức năng hô hấp. nhịp nhàng hoặc chuẩn bị không đầy đủ trước khi tập luyện. Ăn uống đầy đủ và uống nhiều nước trước khi tập luyện. Hoặc đồ uống có ga, ăn đồ ăn khó tiêu hoặc tập thể dục khi bụng đói. Làm thế nào để xử lý? Giảm tốc độ chạy, cúi người và chạy bộ một lúc để giảm đau. Nếu cần thiết, bạn có thể lấy mười giọt nước hoặc xoa bóp các huyệt tương ứng, nếu cơn đau vẫn không thuyên giảm, hãy đến bệnh viện để chẩn đoán và điều trị để loại trừ các bệnh trong ổ bụng hoặc ngoài ổ bụng."
C_948433,小托马斯就是因为心理应激没有做好,托马斯心理应激没有做好,1.0,Bé Thomas học không tốt vì căng thẳng tâm lý.
C_948433,世界上有两片一样的叶子吗,世界两片叶子,1.0,Trên thế giới có hai chiếc lá giống hệt nhau?
C_948433,运动员在测试要求更高,运动员测试要求更高,1.0,Các vận động viên có yêu cầu cao hơn trong việc thử nghiệm
C_948433,适应场地熟悉场地草皮是人造还是天然草地选择合适的鞋子鞋子硬度是否佩戴护膝关节等设备,适应场地熟悉场地草皮人造天然草地选择合适鞋子鞋子硬度是否佩戴护膝关节设备,4.0,Thích ứng với địa điểm. Làm quen với việc sân cỏ là nhân tạo hay tự nhiên. Chọn giày và độ cứng của giày phù hợp.
C_948433,熟悉场地预防损失,熟悉场地预防损失,1.0,Làm quen với trang web để ngăn chặn tổn thất
C_948433,运动防护师教程202秋很好,运动防护师教程202秋,4.0,Hướng dẫn kỹ sư bảo vệ thể thao mùa thu 202 hay lắm
C_948433,先心肺复苏再进行包扎固定最后送医院,先心肺复苏进行包扎固定最后送医院,1.0,"Đầu tiên thực hiện hồi sức tim phổi, sau đó thực hiện băng bó và cố định, cuối cùng đưa đến bệnh viện."
C_948433,先做背阔肌腹肌的拉伸然后再去做手臂的拉伸放松先做臀部周围肌肉拉伸再去做股四头肌内收肌腘绳肌拉伸接下来是小腿腓肠肌比目鱼肌胫骨前肌等的拉伸,先背阔肌腹肌拉伸手臂拉伸放松先臀部周围肌肉拉伸股四头肌内收肌腘绳肌拉伸接下来小腿腓肠肌比目鱼肌胫骨前肌拉伸,2.0,"Đầu tiên kéo căng cơ lưng và cơ bụng, sau đó duỗi và thư giãn cánh tay. Đầu tiên kéo căng các cơ xung quanh mông, sau đó kéo căng cơ tứ đầu và gân kheo. Tiếp theo, thực hiện giãn cơ bắp chân, cơ dép và xương chày trước."
C_948433,静态牵拉股四头肌腘绳肌小腿三头肌胫骨前肌臀大中小肌,静态牵拉股四头肌腘绳肌小腿三头肌胫骨前肌臀大中小肌,5.0,"Kéo giãn tĩnh cơ tứ đầu, gân kheo, cơ tam đầu bắp chân, chày trước, cơ mông lớn, cơ vừa và nhỏ"
C_948433,确保患者颈部保持直位固定不能有任何屈伸位不能一人搬运至少两人,确保患者颈部保持直位固定不能屈伸位不能一人搬运至少两人,1.0,Đảm bảo rằng cổ của bệnh nhân được giữ thẳng và cố định mà không bị uốn cong hoặc duỗi ra. Một người hoặc ít nhất hai người không thể khiêng được.
C_948433,可能会肌肉力量不平衡可出现在各种人身上尤其是对于专项训练的运动员更容易出现该现象,可能肌肉力量平衡出现身上尤其专项训练运动员容易出现现象,1.0,"Sự mất cân bằng về sức mạnh cơ bắp có thể xảy ra ở nhiều người, đặc biệt là những vận động viên được tập luyện đặc biệt dễ mắc phải hiện tượng này hơn."
C_948433,1使伤者的头颈与躯干保持直线位置2用棉布衣物等将伤者颈椎头两侧垫好防止左右摆动3用木板放置头至臀下然后用绷带或布带将额部肩和上胸臀固定于木板上使之稳固,1伤者头颈躯干保持直线位置2棉布衣物伤者颈椎头两侧垫防止左右摆动3木板放置头至臀下绷带布带额部肩胸臀固定木板稳固,10.0,"1. Giữ đầu, cổ và thân của người bị thương ở tư thế thẳng 2. Dùng quần áo cotton để đệm hai bên cột sống cổ và đầu của người bị thương để tránh bị lắc sang trái và phải. đầu xuống phía dưới mông, sau đó dùng băng hoặc băng vải che trán, vai, ngực trên và mông cố định vào tấm gỗ cho ổn định."
C_948433,改变支撑物的稳定性减小支撑面的面积闭上眼睛,改变支撑物稳定性减小支撑面面积闭上眼睛,1.0,"Thay đổi độ ổn định của giá đỡ, giảm diện tích bề mặt giá đỡ và nhắm mắt lại."
C_948433,会例如跳高运动员左右腿肌力就不同,跳高运动员左右腿肌力不同,2.0,"Ví dụ, sức mạnh cơ bắp của chân trái và chân phải của vận động viên nhảy cao là khác nhau."
C_948433,心肺复苏和建立静脉通道扩充血容量同时进行再止血固定包扎就近就医,心肺复苏建立静脉通道扩充血容量进行止血固定包扎就近就医,1.0,"Hồi sức tim phổi và thiết lập các kênh truyền tĩnh mạch để tăng thể tích máu đồng thời cầm máu, cố định và băng bó và tìm tư vấn y tế tại bệnh viện gần nhất"
C_948433,acl损伤跟腱撕裂踝关节损伤,acl损伤跟腱撕裂踝关节损伤,1.0,chấn thương acl rách gân achille chấn thương mắt cá chân
C_948433,通过姿势评估可发现异常的姿势或错误的动作模式及能量泄露情况从而得到相关的关键阶段压力过大或稳定性不足等重要信息从而进行纠正,姿势评估发现异常姿势错误动作模式能量泄露情况得到相关关键阶段压力过大稳定性不足重要信息进行纠正,6.0,"Thông qua đánh giá tư thế, có thể phát hiện ra các tư thế bất thường hoặc kiểu chuyển động sai và rò rỉ năng lượng, đồng thời có thể thu được thông tin quan trọng như áp lực quá mức hoặc độ ổn định không đủ ở các giai đoạn quan trọng để điều chỉnh."
C_948433,踝关节损伤半月板损伤前后交叉韧带撕裂等,踝关节损伤半月板损伤交叉韧带撕裂,2.0,"Chấn thương mắt cá chân, chấn thương sụn chêm, rách dây chằng chéo trước và sau, v.v."
C_948433,主要对下肢进行静态牵拉,主要下肢进行静态牵拉,1.0,Chủ yếu là duỗi tĩnh chi dưới
C_948433,早期用急性处理原则中期理疗晚期改善血液循环,早期急性处理原则中期理疗晚期改善血液循环,2.0,Sử dụng các nguyên tắc điều trị cấp tính ở giai đoạn đầu và vật lý trị liệu ở giai đoạn giữa để cải thiện tuần hoàn máu ở giai đoạn muộn.
C_948433,有一定控制的鞋对足底支撑有一定硬度,一定控制鞋足底支撑一定硬度,4.0,Giày có độ kiểm soát nhất định có độ cứng nhất định để hỗ trợ đế
C_948433,控制中足需要有一定硬度,控制中足需要一定硬度,1.0,Việc kiểm soát phần giữa bàn chân cần có độ cứng nhất định
C_948433,1评估损伤2了解运动习惯3制定治疗方案4合作实施及及时调整方案,1评估损伤2了解运动习惯3制定治疗方案4合作实施及时调整方案,1.0,1 Đánh giá chấn thương 2 Hiểu thói quen tập luyện 3 Xây dựng kế hoạch điều trị 4 Hợp tác thực hiện và điều chỉnh kế hoạch kịp thời
C_948433,运动前后都要充分拉伸肌肉控制运动中强度等,运动充分拉伸肌肉控制运动强度,1.0,"Căng cơ hoàn toàn trước và sau khi tập thể dục để kiểm soát cường độ trong khi tập luyện, v.v."
C_948433,在中国专业的运动防护师数量还不多需要更多有志向的青年去发展壮大,中国专业运动防护师数量需要志向青年发展壮大,2.0,Số lượng các bộ phận bảo vệ thể thao chuyên nghiệp ở Trung Quốc không lớn và cần nhiều người trẻ có tham vọng hơn để phát triển và mở rộng.
C_948433,静态和动态的拉伸,静态动态拉伸,1.0,kéo dài tĩnh và động
C_948433,了解相应运动项目的损伤特点制定相应的预防工作做好及时治疗的准备加强心理教育和监督做好防护管理制度,了解相应运动项目损伤特点制定相应预防工作做好及时治疗准备加强心理教育监督做好防护管理制度,1.0,"Hiểu đặc điểm chấn thương của các sự kiện thể thao tương ứng, xây dựng công tác phòng ngừa tương ứng và chuẩn bị điều trị kịp thời. Tăng cường giáo dục và giám sát tâm lý cũng như thiết lập hệ thống quản lý bảo vệ."
C_948433,确认周围环境安全判断意识呼吸叫人帮忙打120和取aed判断脉搏胸外按压人工呼吸aed,确认周围环境安全判断意识呼吸帮忙120取aed判断脉搏胸外按压人工呼吸aed,1.0,"Xác nhận sự an toàn của môi trường xung quanh, đánh giá nhận thức về hơi thở, gọi 120 để được trợ giúp và lấy AED để đánh giá mạch, ép ngực, hô hấp nhân tạo, AED"
C_948433,静态拉伸动态拉伸震荡牵拉pnf,静态拉伸动态拉伸震荡牵拉pnf,2.0,"Kéo giãn tĩnh, kéo giãn động, kéo dãn dao động pnf"
C_948433,无法判断运动员肌肉与脂肪的比例,无法判断运动员肌肉脂肪比例,1.0,Không thể xác định tỷ lệ cơ và mỡ của vận động viên
C_948433,要注意磷酸原肌糖原和糖酵解功能的恢复,注意磷酸原肌糖原糖酵解功能恢复,1.0,Chú ý đến việc phục hồi chức năng glycogen và glycolysis của cơ phosphogen
C_948433,bmi是人体整体的体重身高的平方反应的是体重与身高的关系而不能反应脂肪的分布运动员由于肌肉重量大体重重bmi偏高但不能说运动员肥胖,bmi人体整体体重身高平方反应体重身高关系不能反应脂肪分布运动员肌肉重量大体重重bmi偏高不能运动员肥胖,3.0,BMI là bình phương của cân nặng và chiều cao tổng thể của cơ thể. Nó phản ánh mối quan hệ giữa cân nặng và chiều cao và không thể phản ánh sự phân bổ mỡ. Các vận động viên có chỉ số BMI cao do khối lượng cơ bắp lớn nhưng không thể nói là béo phì.
C_948433,首先对患者的足跟痛进行损伤的评估其次根据疼痛的程度及情况采取实施进行预防方案如果是鞋子不合适导致的建议更换跑鞋等,患者足痛进行损伤评估疼痛程度情况采取实施进行预防方案鞋子合适导致建议更换跑鞋,1.0,"Đầu tiên, đánh giá chấn thương đau gót chân của bệnh nhân. Thứ hai, thực hiện kế hoạch phòng ngừa dựa trên mức độ và tình trạng đau. Nếu nguyên nhân là do giày không phù hợp thì nên thay giày chạy bộ, v.v."
C_948433,运动员肌肉发达了无法判断肌肉脂肪的比例,运动员肌肉发达无法判断肌肉脂肪比例,1.0,Vận động viên đã phát triển cơ bắp và không thể xác định được tỷ lệ cơ và mỡ.
C_948433,对运动员要求更高,运动员要求更高,4.0,Yêu cầu cao hơn đối với vận động viên
C_948433,运动防护师教程2020春非常好,运动防护师教程2020春非常,32.0,Hướng dẫn bảo hộ thể thao mùa xuân 2020 rất hay
C_948433,耐力力量速度耐力灵活性平衡性协调性,耐力力量速度耐力灵活性平衡性协调性,1.0,Sức bềnSức mạnhTốc độSức bềnLinh hoạtCân bằngPhối hợp
C_948433,患者颈椎处于中立位不要随意搬运患者,患者颈椎处于中立位不要随意搬运患者,1.0,Cột sống cổ của bệnh nhân ở vị trí trung lập. Không di chuyển bệnh nhân một cách bất cẩn.
C_948433,根据损伤情况和恢复情况来定若状况较好可不继续佩戴,损伤情况恢复情况来定状况可不继续佩戴,1.0,"Nó sẽ được xác định dựa trên tình trạng chấn thương và quá trình phục hồi. Nếu tình trạng tốt, bạn có thể không tiếp tục đeo nó."
C_948433,由运动引起的腹部疼痛腹部疼痛按摩,运动引起腹部疼痛腹部疼痛按摩,1.0,Đau bụng do tập thể dục Massage đau bụng
C_948433,耐力速度灵活力量协调,耐力速度灵活力量协调,7.0,Sức bền Tốc độ Linh hoạt Sức mạnh Phối hợp
C_948433,需要提高肌肉的温度预防损伤的发生,需要提高肌肉温度预防损伤发生,1.0,Cần tăng nhiệt độ cơ để tránh chấn thương
C_948433,为一个患者进行站立为静态评估首先应确保该患者没有功能与结构类伤病或其他能影响能够进行长时间保持站立姿态的疾病在进行静态姿势评估应两腿自然垂直站立两手自然下垂目视前方尽量穿能少穿衣服以便能够观察到需要观察的体表特征第一先从背面观开始以垂线为参照观察头顶到地面在上垂直轴脊柱和两侧躯干和四肢脊柱有没有侧弯两侧躯干宽度如果四肢远离离身体轴线的远近然后是水平轴上耳垂肩峰肩甲下角髂后上棘腘窝线是否水平在观察小臂和掌心是否过旋小腿和跟骨形状大小以及足弓有无塌陷第二前面观也是从头顶垂线观察从上往下看有无斜颈锁骨角度和颈窝深浅乳头是否水平小臂与虎口旋转度髂前上棘连线下肢大小腿关节角度和脚的外八和内八角度第三侧面观观察脊柱前后凸凹度垂线是否穿过耳垂肩峰腰椎股骨大转子腓骨小头外踝前一点,进行 站立 应 确保 没有 能够 进行 保持 站立 进行 应 垂直 站立 下垂 穿能 少 能够 观察 需要 观察 参照 观察 有没有 侧弯 远离 窝 是否 观察 掌心 是否 小 有无 塌陷 是从 观察 有无 深浅 是否 旋转 观察 是否 穿过,1.0,"Khi thực hiện đánh giá tư thế tĩnh trên bệnh nhân, trước tiên bạn phải đảm bảo rằng bệnh nhân không có tổn thương về chức năng hoặc cấu trúc hoặc các bệnh khác có thể ảnh hưởng đến khả năng duy trì tư thế đứng trong thời gian dài. Khi thực hiện đánh giá tư thế tĩnh, bệnh nhân. nên đứng với hai chân thẳng đứng một cách tự nhiên và hai tay buông thõng tự nhiên trong khi nhìn về phía trước. Cố gắng mặc ít quần áo nhất có thể để bạn có thể quan sát các đặc điểm bề mặt cơ thể cần quan sát. Đầu tiên, hãy bắt đầu từ góc nhìn phía sau và sử dụng chiều dọc. đường thẳng làm tham chiếu để quan sát trục thẳng đứng từ đỉnh đầu xuống đất, cột sống và hai bên thân và các chi, đồng thời xem có các đường cong bên ở cột sống ở cả hai bên chiều rộng của thân hay không. cách xa trục cơ thể Gần và xa, sau đó trên trục ngang, dái tai, mỏm vai, giáp vai góc dưới, gai chậu sau trên và đường hố khoeo có nằm ngang không. bắp chân và xương gót, và liệu vòm bàn chân có bị xẹp hay không. Mặt trước thứ hai cũng được treo từ trên xuống dưới để xem có bị vẹo xương đòn hay không. Và độ sâu của hố cổ, cho dù núm vú có nằm ngang hay không, độ xoay của cẳng tay và miệng hổ, đường nối gai chậu trước trên, góc khớp của chi dưới và đùi, góc ngoài và góc trong của bàn chân. Quan sát từ góc nhìn thứ ba xem đường thẳng đứng của phần lồi và lõm phía trước và sau của cột sống có đi qua dái tai và đốt sống thắt lưng mỏm cùng lớn hơn của xương đùi hơi ở phía trước mắt cá ngoài của xương mác hay không."
C_948433,有必要全身肌肉互相联系表现出协同和拮抗作用,必要全身肌肉互相联系表现出协同拮抗作用,1.0,Các cơ trên toàn cơ thể cần giao tiếp với nhau để thể hiện tác dụng hiệp đồng và đối kháng
C_948433,对头部造成符合脑震荡标准的任何打击应当休息简单低强度的有氧运动针对性的专项运动练习有接触性的比赛或训练对参与者加强教育严格遵守比赛规则佩戴运动护具,头部造成符合脑震荡标准打击应当休息简单低强度有氧运动针对性专项运动练习接触性比赛训练参与者加强教育严格遵守比赛规则佩戴运动护具,1.0,"Bất kỳ cú đánh nào vào đầu đáp ứng các tiêu chí về chấn động đều phải được nghỉ ngơi, tập thể dục nhịp điệu cường độ thấp đơn giản, luyện tập các môn thể thao đặc biệt có mục tiêu, thi đấu hoặc huấn luyện tiếp xúc và tăng cường giáo dục cho những người tham gia tuân thủ nghiêm ngặt các quy tắc thi đấu và mặc đồ bảo hộ thể thao."
C_948433,预防环境损伤,预防环境损伤,1.0,Ngăn chặn thiệt hại về môi trường
C_948433,1伤者头颈和躯干保持直线位置2用棉布衣物将伤者颈椎头两侧垫好防止左右摆动3用木板放置头至臀下然后用本该或布带将额部肩和上胸臀固定于木板上,1伤者头颈躯干保持直线位置2棉布衣物伤者颈椎头两侧垫防止左右摆动3木板放置头至臀下本该布带额部肩胸臀固定木板,1.0,"1. Giữ đầu, cổ và thân của người bị thương ở tư thế thẳng 2. Dùng quần áo cotton để đệm hai bên đốt sống cổ của người bị thương để tránh bị lắc sang trái và phải 3. Dùng tấm gỗ để đặt đầu. đến phía dưới mông rồi dùng dây gỗ hoặc dây vải cố định trán, vai, ngực trên và mông trên tấm gỗ."
C_948433,从哪里考证,考证,1.0,Xác minh từ đâu
C_948433,往前屈身可以缓解,往前屈身缓解,1.0,Cúi về phía trước có thể làm dịu
C_948433,运动员肌肉含量较高bmi无法进行评价,运动员肌肉含量高bmi无法进行评价,1.0,Vận động viên có khối lượng cơ bắp cao không thể đánh giá chỉ số BMI của họ
C_948433,需要提高肌肉温度预防运动损伤,需要提高肌肉温度预防运动损伤,1.0,Cần tăng nhiệt độ cơ để phòng tránh chấn thương khi chơi thể thao
C_948433,关节变形或移位,关节变形移位,1.0,Biến dạng hoặc dịch chuyển khớp
C_948433,由美国传入我国还需努力,美国传入我国需努力,1.0,Nó vẫn cần phải nỗ lực để được giới thiệu từ Hoa Kỳ vào nước ta
C_948433,会丢铅球的投球手比另一只手力量大很多,丢铅球投球手比另一只手力量很多,4.0,Người ném bóng có sức mạnh hơn tay kia rất nhiều.
C_948433,训练积极性训练效率睡眠食欲,训练积极性训练效率睡眠食欲,1.0,Động lực tập luyện Hiệu quả tập luyện Ngủ ngon miệng
C_948433,症状消失后在平时不需要带护具但是参加运动过程中还是建议佩戴护具增加腰部稳定性,症状消失平时需要带护具参加运动过程建议佩戴护具增加腰部稳定性,2.0,"Sau khi các triệu chứng biến mất, không cần mặc đồ bảo hộ trong sinh hoạt hàng ngày nhưng vẫn nên mặc đồ bảo hộ để tăng độ ổn định cho vòng eo khi tham gia thể thao."
C_948433,要先弄明白是什么原因导致的休克然后有条件的话一定要尽快处理保证循环系统3分钟测一次血压观察血压是否稳定休克处理好了以后对骨折处进行固定处理及时送往医院,先弄明白原因导致休克条件一定尽快处理保证循环系统3分钟测一次血压观察血压是否稳定休克处理以后骨折处进行固定处理及时送往医院,1.0,Đầu tiên chúng ta phải tìm hiểu nguyên nhân gây sốc và nếu có thể hãy điều trị càng sớm càng tốt để đảm bảo hệ tuần hoàn được đo 3 phút một lần để quan sát xem huyết áp có ổn định hay không. và gửi nó đến bệnh viện ngay lập tức.
C_948433,进行正确的姿态状态评估能更好的发现问题便于纠正错误姿势,进行正确姿态状态评估更好发现问题纠正错误姿势,1.0,Đánh giá tư thế đúng có thể xác định vấn đề tốt hơn và sửa tư thế sai
C_948433,对症下药,对症下药,1.0,Kê đơn thuốc phù hợp
C_948433,从前面老师挺过来感觉变成了智能机器人老师都是在对着提词器读书还不如直接把相关章节放出来,前面老师挺过来感觉变成智能机器人老师提词器读书直接相关章节放,1.0,"Từ giáo viên trước mặt, tôi có cảm giác như mình đã trở thành một người máy thông minh. Giáo viên đang đọc cho máy nhắc chữ. Tốt hơn là chỉ phát ra các chương có liên quan."
C_948433,我认为运动防护师是很重要的但是我国现在这方面的人才还比较缺少而且这个观念也不是很普及我们应该多向国外学习这方面并运用到具体项目中,认为运动防护师是重要我国现在这方面人才比较缺少观念普及应该多向国外学习这方面运用具体项目,1.0,"Tôi nghĩ các kỹ sư bảo vệ thể thao rất quan trọng, nhưng nước ta vẫn còn tương đối thiếu nhân tài trong lĩnh vực này và khái niệm này chưa phổ biến lắm. Chúng ta nên tìm hiểu thêm về khía cạnh này từ nước ngoài và áp dụng vào các dự án cụ thể."
C_948433,肩袖肌群保持上肢带的稳定腰背部肌群保持躯干的稳定性股四头肌胴绳肌保持膝关节的稳定性小腿三头肌胫前肌腓骨长短肌保持踝关节的稳定,肩袖肌群保持上肢带稳定腰背部肌群保持躯干稳定性股四头肌胴绳肌保持膝关节稳定性小腿三头肌胫前肌腓骨长短肌保持踝关节稳定,1.0,Các cơ vòng quay duy trì sự ổn định của đai chi trên. Các cơ lưng dưới duy trì sự ổn định của thân. Cơ gân kheo cơ tứ đầu đùi duy trì sự ổn định của khớp gối. khớp cổ chân.
C_948433,可以帮助我们更好的保护自己,帮助更好保护,1.0,Có thể giúp chúng ta bảo vệ bản thân tốt hơn
C_948433,运动防护师的发展源远流长运动防护师的职责有5个大的方面做好这几点不容易任重而道远,运动防护师发展源远流长运动防护师职责5方面做好几点容易任重而道远,2.0,Sự phát triển của các bộ phận bảo vệ thể thao có một lịch sử lâu dài. Trách nhiệm của các bộ phận bảo vệ thể thao có năm khía cạnh chính. Để làm tốt những việc này là không dễ và còn một chặng đường dài.
C_948433,熟悉场地了解场地和训练场地的异同同时预防不必要的运动损伤,熟悉场地了解场地训练场地异同预防不必要运动损伤,1.0,"Làm quen với địa điểm, hiểu những điểm tương đồng và khác biệt giữa địa điểm và địa điểm tập luyện, đồng thời ngăn ngừa những chấn thương thể thao không đáng có."
