course_id,text,filtered_text,count,text_vi
C_948427,根据财政部和税务总局2月7日发布的财政部税务总局关于支持新型冠状病毒感染的肺炎疫情防控有关捐赠税收政策的公告a企业通过民政部门捐赠用于应对新型冠状病毒感染的肺炎疫情的500万元现金允许在计算应纳税所得额时全额扣除b公司将自产的10万件防护服通过中华慈善总会无偿捐赠用于应对新型冠状病毒感染的肺炎疫情免征增值税消费税城市维护建设税教育费附加地方教育附加c先生直接向承担疫情防治任务的医院捐赠用于应对新型冠状病毒感染的肺炎疫情的1万只医用口罩允许在计算应纳税所得额时全额扣除但需要注意的是c先生需要凭承担疫情防治任务的医院开具的捐赠接收函办理税前扣除事宜,发布 支持 感染 捐赠 捐赠 用于 应对 感染 允许 计算 应 扣除 无偿 捐赠 用于 应对 感染 免征 维护 附加 附加 承担 防治 捐赠 用于 应对 感染 允许 计算 应 扣除 需要 注意 需要 承担 防治 开具 捐赠 接收 扣除,1.0,"Theo Thông báo của Bộ Tài chính và Cục Quản lý Thuế Nhà nước về Chính sách Thuế quyên góp nhằm hỗ trợ phòng ngừa và kiểm soát dịch bệnh viêm phổi do nhiễm vi rút Corona mới do Bộ Tài chính và Cục Quản lý Thuế Nhà nước ban hành vào ngày 7 tháng 2, a công ty quyên góp thông qua bộ phận dân sự để ứng phó với dịch bệnh viêm phổi do nhiễm coronavirus mới. Được phép khấu trừ toàn bộ 5 triệu nhân dân tệ khi tính thu nhập chịu thuế Công ty b tặng miễn phí 100.000 bộ quần áo bảo hộ tự sản xuất. thông qua Liên đoàn từ thiện Trung Quốc để ứng phó với loại virus Corona mới. Dịch viêm phổi do nhiễm virus Corona mới được miễn thuế giá trị gia tăng và thuế tiêu dùng. Thuế bảo trì và xây dựng đô thị, phụ phí giáo dục, phụ phí giáo dục địa phương tặng trực tiếp 10.000 khẩu trang y tế cho bệnh viện phụ trách nhiệm vụ. Được phép tặng 10.000 khẩu trang y tế để ứng phó với dịch bệnh viêm phổi do nhiễm virus Corona mới. Tuy nhiên, cần lưu ý ông C cần xử lý. khấu trừ trước thuế kèm theo giấy biên nhận quyên góp của bệnh viện chịu trách nhiệm phòng chống dịch."
C_948427,能够享受免征个人所得税的优惠待遇根据财政部税务总局关于支持新型冠状病毒感染的肺炎疫情防控有关个人所得税政策的公告对参加疫情防治工作的医务人员和防疫工作者按照政府规定标准取得的临时性工作补助和奖金免征个人所得税,能够享受免征个人所得税优惠待遇财政部税务总局支持新型冠状病毒感染肺炎疫情防控个人所得税政策公告参加疫情防治工作医务人员防疫工作者政府规定标准取得临时性工作补助奖金免征个人所得税,2.0,"Có thể được hưởng ưu đãi miễn thuế thu nhập cá nhân Theo thông báo của Bộ Tài chính và Cục Thuế Nhà nước về chính sách thuế thu nhập cá nhân nhằm hỗ trợ phòng, chống dịch bệnh viêm phổi do nhiễm virus Corona mới, y tế. nhân viên, người lao động phòng chống dịch bệnh tham gia công tác phòng, chống dịch bệnh được miễn thuế tạm thời theo tiêu chuẩn do Chính phủ quy định, được miễn thuế thu nhập cá nhân."
C_948427,①企业和个人通过公益性社会组织或者县级以上人民政府及其部门等国家机关捐赠用于应对新型冠状病毒感染的肺炎疫情的现金和物品允许在计算应纳税所得额时全额扣除a企业捐赠的500万元现金允许在计算应纳税所得额时全额扣除②单位和个体工商户将自产委托加工或购买的货物通过公益性社会组织和县级以上人民政府及其部门等国家机关或者直接向承担疫情防治任务的医院无偿捐赠用于应对新型冠状病毒感染的肺炎疫情的免征增值税消费税城市维护建设税教育费附加地方教育附加b公司将自产的10万件防护服免征增值税消费税城市维护建设税教育费附加地方教育附加③企业和个人直接向承担疫情防治任务的医院捐赠用于应对新型冠状病毒感染的肺炎疫情的物品允许在计算应纳税所得额时全额扣除捐赠人凭承担疫情防治任务的医院开具的捐赠接收函办理税前扣除事宜c先生捐赠的1万只医用口罩允许在计算应纳税所得额时全额扣除,组织 捐赠 用于 应对 感染 允许 计算 应 扣除 捐赠 允许 计算 应 扣除 购买 组织 承担 防治 无偿 捐赠 用于 应对 感染 免征 维护 附加 附加 免征 维护 附加 附加 承担 防治 捐赠 用于 应对 感染 允许 计算 应 扣除 承担 防治 开具 捐赠 接收 扣除 捐赠 允许 计算 应 扣除,1.0,"① Tiền mặt và các vật phẩm do doanh nghiệp và cá nhân quyên góp thông qua các tổ chức xã hội phúc lợi công cộng hoặc các cơ quan nhà nước như chính quyền nhân dân từ cấp quận trở lên và các cơ quan trực thuộc để ứng phó với dịch viêm phổi do nhiễm vi rút Corona mới sẽ được phép khấu trừ toàn bộ khi tính toán thu nhập chịu thuế Tài trợ của doanh nghiệp Số tiền mặt 5 triệu được phép tính toán. ② Các đơn vị và hộ gia đình công nghiệp và thương mại cá nhân ủy thác hàng hóa tự sản xuất, gia công hoặc mua cho các cơ quan nhà nước như các tổ chức xã hội phúc lợi công cộng và chính quyền nhân dân cấp quận trở lên và các cơ quan của họ, hoặc trực tiếp đến các bệnh viện chịu trách nhiệm phòng chống dịch bệnh, hiến phổi miễn phí để ứng phó với virus Corona. Tình hình dịch bệnh được miễn thuế VAT và thuế tiêu dùng, thuế bảo trì và xây dựng đô thị, phụ phí giáo dục và phụ phí giáo dục địa phương b. Công ty sẽ miễn thuế VAT và thuế xây dựng cho 100.000 bộ quần áo bảo hộ tự sản xuất. học phí và phụ phí giáo dục địa phương ③ Các doanh nghiệp và cá nhân trực tiếp nộp đơn xin quyên góp từ các bệnh viện chịu trách nhiệm phòng chống dịch bệnh được sử dụng cho Các vật phẩm dùng để ứng phó với dịch bệnh viêm phổi do nhiễm virus Corona mới được phép khấu trừ toàn bộ khi tính thu nhập chịu thuế. Nhà tài trợ có thể xin khấu trừ trước thuế bằng giấy chấp nhận quyên góp do bệnh viện chịu trách nhiệm phòng chống dịch bệnh cấp. 10.000 khẩu trang y tế do ông C tặng được phép khấu trừ toàn bộ khi tính thu nhập chịu thuế."
C_948427,可以的根据财政部税务局关于支持新型冠状病毒感染的肺炎疫情防控有关个人所得税政策的公告对一线的医务人员取的的补助和奖金是免征所得税的,财政部税务局支持新型冠状病毒感染肺炎疫情防控个人所得税政策公告一线医务人员取补助奖金免征所得税,1.0,"Có, theo thông báo của Bộ Tài chính và Cục Thuế về chính sách thuế thu nhập cá nhân nhằm hỗ trợ phòng chống dịch bệnh viêm phổi do nhiễm virus Corona mới, các khoản trợ cấp, tiền thưởng mà nhân viên y tế tuyến đầu nhận được được miễn thuế thu nhập."
C_948427,企业和个人通过满足条件公益性社会组织或县级以上政府部门和国家机关捐赠的款项或者实物可以按照公与允价值全额扣除所以两公司所捐赠的物品可以在计算企业纳税所得时全额扣除是有法律依据的同时个人也可以按照政策办理全额扣除优惠的但是需要相关单位开据发票作为扣除凭证政府机关除外,企业个人满足条件公益性社会组织县级政府部门国家机关捐赠款项实物公与允价值全额扣除两公司捐赠物品计算企业纳税所得全额扣除法律依据个人政策办理全额扣除优惠需要相关单位开据发票扣除凭证政府机关,1.0,"Các khoản quyên góp hoặc đồ vật do doanh nghiệp và cá nhân quyên góp thông qua các tổ chức xã hội phúc lợi công cộng đủ tiêu chuẩn hoặc các cơ quan chính phủ và cơ quan nhà nước ở cấp quận trở lên có thể được khấu trừ toàn bộ dựa trên giá trị hợp lý của chúng. Do đó, các món đồ do hai công ty quyên góp có thể được khấu trừ toàn bộ. khi tính thuế thu nhập doanh nghiệp có cơ sở pháp lý và cá nhân cũng có thể xin giảm trừ toàn bộ theo chính sách nhưng các đơn vị liên quan cần phải xuất hóa đơn làm chứng từ khấu trừ, trừ cơ quan nhà nước."
C_948427,根据关于支持新型冠状病毒感染的肺炎疫情防控有关捐赠税收政策的公告的规定1企业和个人通过公益性社会组织或者县级以上人民政府及其部门等国家机关捐赠用于应对新型冠状病毒感染的肺炎疫情的现金和物品允许在计算应纳税所得额时全额扣除企业和个人直接向承担疫情防治任务的资源捐赠用于应对新型冠状病毒感染的肺炎疫情的物品允许在计算应纳税所得额时全额扣除因此本案例中abc用于捐赠的物资的价值都可享受全额扣除优惠,支持 感染 捐赠 组织 捐赠 用于 应对 感染 允许 计算 应 扣除 承担 防治 捐赠 用于 应对 感染 允许 计算 应 扣除 用于 捐赠 享受 扣除,1.0,"Theo quy định của Thông báo về chính sách thuế quyên góp nhằm hỗ trợ phòng chống dịch bệnh viêm phổi do nhiễm vi rút Corona mới 1, các doanh nghiệp và cá nhân quyên góp thông qua các tổ chức xã hội phúc lợi công cộng hoặc các cơ quan nhà nước như chính quyền nhân dân cấp quận trở lên và các bộ phận của họ để ứng phó với tình trạng lây nhiễm coronavirus mới. Tiền mặt và các vật phẩm được phép sử dụng trong thời gian xảy ra dịch viêm phổi đều được đưa vào tính toán. Toàn bộ số tiền được khấu trừ khi tính thu nhập chịu thuế. Doanh nghiệp, cá nhân trực tiếp quyên góp vật phẩm cho các nguồn có nhiệm vụ phòng, chống dịch ứng phó với dịch bệnh viêm phổi do virus Corona mới gây ra được khấu trừ toàn bộ khi tính thu nhập chịu thuế. Vì vậy, trong trường hợp này abc sử dụng Giá trị vật liệu quyên góp có thể được khấu trừ toàn bộ."
C_948427,不具有合理的商业目的ict的股权转让仅仅是为了少交企业所得税的公司内幕交易行为不具有合理商业目的第二实质性交易应该具有制造经营管理等活动当事人如果仅仅从事投资活动还不足以满足实质性交易的要求,具有合理商业目的ict股权转让仅仅少交企业所得税公司内幕交易行为具有合理商业目的第二实质性交易应该具有制造经营管理活动当事人仅仅从事投资活动不足以满足实质性交易要求,1.0,"Không có mục đích kinh doanh hợp lý. Việc chuyển nhượng vốn cổ phần của ict chỉ đơn thuần là một hành vi giao dịch nội bộ của công ty để giảm việc nộp thuế thu nhập doanh nghiệp. Hành vi này không có mục đích kinh doanh hợp lý nên liên quan đến các hoạt động như sản xuất, vận hành. và quản lý, nếu các bên chỉ tham gia vào hoạt động đầu tư thì chưa đủ để đáp ứng yêu cầu về mua bán dâm."
C_948427,a企业和b企业可以全额扣除因为这是通过国家机关和公益组织捐助的c企业需要办理相关手续才可以全额扣除因为是直接捐赠给承担疫情防治任务的某医院,a企业b企业全额扣除这是国家机关公益组织捐助c企业需要办理相关手续全额扣除直接捐赠承担疫情防治任务医院,2.0,Doanh nghiệp a và doanh nghiệp b được khấu trừ toàn bộ số tiền do được tài trợ thông qua cơ quan nhà nước và các tổ chức phúc lợi công cộng. Doanh nghiệp c cần phải làm các thủ tục liên quan trước khi được khấu trừ toàn bộ số tiền do được tài trợ trực tiếp cho bệnh viện chịu trách nhiệm phòng chống dịch bệnh. nhiệm vụ kiểm soát.
C_948427,可以享受免征个人所得税的优待因为根据中华人民共和国个人所得税法中规定省级人民政府国务院部委和中国人民解放军军以上单位以及外国组织国际组织颁发的科学教育技术文化卫生体育环境保护等方面的奖金免征个人所得税而参加疫情防治的医务人员和防疫工作者的临时性补助是由省级政府以上发的奖金故可享受免征个人所得税,享受免征个人所得税优待中华人民共和国个人所得税法规定省级人民政府国务院部委中国人民解放军军单位外国组织国际组织颁发科学教育技术文化卫生体育环境保护方面奖金免征个人所得税参加疫情防治医务人员防疫工作者临时性补助省级政府发奖金故可享受免征个人所得税,1.0,"Bạn có thể được hưởng ưu đãi miễn thuế thu nhập cá nhân vì theo quy định của Luật thuế thu nhập cá nhân của Cộng hòa Nhân dân Trung Hoa, các khoản thưởng về khoa học, giáo dục, công nghệ, văn hóa, y tế, thể thao, bảo vệ môi trường, v.v. được ban hành của chính quyền nhân dân cấp tỉnh, các bộ và ủy ban của Quốc vụ viện, các đơn vị trên cấp quân sự của Quân đội Giải phóng Nhân dân Trung Quốc và các tổ chức nước ngoài, tổ chức quốc tế Trợ cấp tạm thời cho nhân viên y tế và nhân viên phòng chống dịch bệnh được miễn thuế thu nhập cá nhân và tham gia phòng chống dịch bệnh là tiền thưởng do chính quyền cấp tỉnh trở lên cấp nên được miễn thuế thu nhập cá nhân."
C_948427,这个长沙的应纳税额是怎么计算的,长沙应纳税额计算,1.0,Số thuế phải nộp ở Trường Sa được tính như thế nào?
C_948427,1不恰当安康公司销售额与折扣额未在同一张发票金额栏上分别注明因此不能按照折扣后的销售额确定增值税销项税额2不恰当以旧换新销售中计算增值税销项税额的销售额应当加上折抵部分价款3恰当购进的设备用于应税的经营活动取得增值税专用发票可以抵扣进项税4不恰当税法规定以物易物方式销售时双方都应作出购销处理以各自发出的货物核算销售额并计算销项税额以各自收到的货物核算购货额并计算进项税额安康公司收取的违约金作为价外费用应计入增值税销项税额5不恰当双方无实际销售行为协同虚开增值税发票不符合法律规定,折扣 注明 不能 折扣 确定 计算 应当 加上 折抵 购进 用于 应税 取得 抵扣 应 作出 购销 处理 发出 计算 收到 计算 收取 应 计入 行为 虚开 符合,1.0,1. Doanh số bán hàng và số tiền chiết khấu của Công ty Ankang không phù hợp không được ghi riêng trong cột số tiền của cùng một hóa đơn nên không thể xác định thuế giá trị gia tăng đầu ra dựa trên doanh số bán hàng sau khi chiết khấu. 2. Doanh số bán hàng không phù hợp trong việc tính giá trị đầu ra. -Thuế bổ sung trong bán hàng trao đổi phải được cộng vào một phần giá3. Thiết bị mua phù hợp sẽ được sử dụng cho các hoạt động kinh doanh chịu thuế và có thể lấy hóa đơn VAT đặc biệt để khấu trừ thuế đầu vào4. Luật thuế chưa đúng quy định hai bên phải thực hiện giao dịch mua bán khi bán hàng đổi hàng. Tính số tiền bán ra theo số hàng hóa mỗi bên gửi đi và tính thuế đầu ra tính thuế đầu vào theo số hàng hóa đó. mỗi bên nhận được. Khoản bồi thường thiệt hại do Công ty Ankang thu Là chi phí ngoài giá nên được tính vào thuế giá trị gia tăng đầu ra 5. Cả hai bên không có hành vi bán hàng thực tế và hợp tác để xuất hóa đơn VAT sai quy định. không tuân thủ các quy định của pháp luật.
C_948427,1安康公司的税务处理不恰当销售额与折扣额未在同一张发票金额栏上分别注明则折扣额不得在销售额中减除同时厂家提供价税合计金额2的现金折扣其折扣额也不得从安康公司的销售额中减除2安康公司的税务处理不恰当采取以旧换新方式销售一般按新货同期销售价格确定销售额不得减除旧货收购价格3安康公司的税务处理恰当购进的设备用于生产经营活动安康公司可将该设备相关的增值税进项税额予以抵扣4安康公司的税务处理不恰当采取以物易物方式销售双方应以各自发出的应税销售行为核算销售额并计算销项税额同时安康公司收取的违约金属于价外费用应确认增值税销项税额计算缴纳增值税5安康公司的税务处理不恰当在没有真实交易的情况下即向对方开具增值税专用发票其行为属于虚开增值税专用发票同时安康公司的税务处理也会导致其他问题比如销售额的虚增会影响债权人正确判断公司真实的经营状况和偿债能力,处理 折扣 注明 折扣 减除 提供 折扣 折扣 减除 处理 采取 确定 减除 处理 购进 用于 相关 予以 抵扣 处理 采取 应 发出 应税 行为 计算 收取 属于 应 确认 计算 缴纳 处理 没有 开具 行为 属于 虚开 处理 导致 虚增 判断 偿债,1.0,"1. Cách xử lý thuế của Công ty Ankang là không phù hợp. Nếu doanh số bán hàng và số tiền chiết khấu không được ghi riêng trong cột số tiền của cùng một hóa đơn thì số tiền chiết khấu sẽ không được khấu trừ vào doanh số bán hàng, đồng thời nếu nhà sản xuất cung cấp. giảm giá bằng tiền mặt tổng giá và số tiền thuế 2, số tiền chiết khấu sẽ không được phép khấu trừ thuế của Công ty Ankang 2 từ doanh thu của Công ty Ankang. Xử lý thuế không phù hợp, phương thức bán hàng trao đổi thường được xác định dựa trên giá bán hàng hóa mới trong cùng kỳ và không thể khấu trừ giá mua hàng hóa cũ. 3 Xử lý thuế của Công ty Ankang Nếu sử dụng thiết bị đã mua. đối với hoạt động sản xuất kinh doanh, Công ty Ankang được sử dụng giá trị gia tăng liên quan đến thiết bị sẽ được khấu trừ thuế đầu vào. Việc xử lý thuế của Công ty Ankang là không phù hợp và phương thức bán hàng là trao đổi. Cả hai bên nên tính toán doanh thu và tính thuế đầu ra dựa trên hành vi bán hàng chịu thuế do nhau ban hành. chi phí ngoài giá và phải được ghi nhận là thuế giá trị gia tăng đầu ra. Tính thuế giá trị gia tăng đã nộp cho cơ quan thuế Công ty Ankang. Việc xử lý không đúng cách việc phát hành hóa đơn VAT đặc biệt cho bên kia mà không có giao dịch thực tế sẽ cấu thành việc phát hành sai hóa đơn VAT đặc biệt. Đồng thời, việc xử lý thuế của Công ty Ankang cũng sẽ dẫn đến các vấn đề khác, chẳng hạn như doanh thu tăng cao. sẽ ảnh hưởng đến phán đoán đúng đắn của chủ nợ về điều kiện hoạt động thực tế và khả năng thanh toán của công ty."
C_948427,根据关于支持新型冠状病毒感染的肺炎疫情防控有关捐赠税收政策的公告的规定1企业和个人通过公益性社会组织或者县级以上人民政府及其部门等国家机关捐赠用于应对新型冠状病毒感染的肺炎疫情的现金和物品允许在计算应纳税所得额时全额扣除因此a公司通过民政部门捐赠用于新冠肺炎的治疗的现金500万元和b公司捐赠给中华慈善总会的10万件防护服可以享受全额扣除的税收优惠2企业和个人直接向承担疫情防治任务的资源捐赠用于应对新型冠状病毒感染的肺炎疫情的物品允许在计算应纳税所得额时全额扣除因此c先生直接捐赠给承担疫情防治任务的某医院的1万只医用口罩可以享受全额扣除的税收优惠但办理税前扣除事宜时应出示该医院开具的捐赠接收函作为凭证,支持 感染 捐赠 组织 捐赠 用于 应对 感染 允许 计算 应 扣除 捐赠 用于 治疗 捐赠 享受 扣除 承担 防治 捐赠 用于 应对 感染 允许 计算 应 扣除 捐赠 承担 防治 享受 扣除 扣除 出示 开具 捐赠 接收,2.0,"Theo quy định của Thông báo về chính sách thuế quyên góp nhằm hỗ trợ phòng chống dịch bệnh viêm phổi do nhiễm vi rút Corona mới 1, các doanh nghiệp và cá nhân quyên góp thông qua các tổ chức xã hội phúc lợi công cộng hoặc các cơ quan nhà nước như chính quyền nhân dân cấp quận trở lên và các bộ phận của họ để ứng phó với tình trạng lây nhiễm virus Corona mới. Tiền mặt và các vật phẩm liên quan đến dịch viêm phổi được phép khấu trừ toàn bộ khi tính thu nhập chịu thuế. Do đó, Công ty A đã quyên góp 5 triệu nhân dân tệ bằng tiền mặt để điều trị dịch bệnh COVID-19 thông qua các hoạt động dân sự. và Công ty B đã quyên góp 5 triệu nhân dân tệ cho China Charity. 100.000 bộ quần áo bảo hộ của Liên đoàn có thể được khấu trừ toàn bộ thuế. 2 Doanh nghiệp, cá nhân trực tiếp quyên góp vật phẩm cho các nguồn lực chịu trách nhiệm phòng chống dịch ứng phó với dịch bệnh viêm phổi do nhiễm virus Corona mới được phép khấu trừ toàn bộ khi tính thuế. Do đó, 10.000 khẩu trang y tế do ông C trực tiếp tặng cho bệnh viện chịu trách nhiệm phòng chống dịch bệnh được hưởng ưu đãi khấu trừ thuế toàn bộ. nên được xuất trình dưới dạng chứng từ."
C_948427,根据关于支持新型冠状病毒感染的肺炎疫情防控有关捐赠税收政策的公告的规定1企业和个人通过公益性社会组织或者县级以上人民政府及其部门等国家机关捐赠用于应对新型冠状病毒感染的肺炎疫情的现金和物品允许在计算应纳税所得额时全额扣除所以a和b公司可以享受全额扣除的税收优惠2企业和个人直接向承担疫情防治任务的资源捐赠用于应对新型冠状病毒感染的肺炎疫情的物品允许在计算应纳税所得额时全额扣除因此c先生可以享受全额扣除的税收优惠但办理税前扣除事宜时应出示该医院开具的捐赠接收函作为凭证,支持 感染 捐赠 组织 捐赠 用于 应对 感染 允许 计算 应 扣除 享受 扣除 承担 防治 捐赠 用于 应对 感染 允许 计算 应 扣除 享受 扣除 扣除 出示 开具 捐赠 接收,1.0,"Theo quy định của Thông báo về chính sách thuế quyên góp nhằm hỗ trợ phòng chống dịch bệnh viêm phổi do nhiễm vi rút Corona mới 1, các doanh nghiệp và cá nhân quyên góp thông qua các tổ chức xã hội phúc lợi công cộng hoặc các cơ quan nhà nước như chính quyền nhân dân cấp quận trở lên và các bộ phận của họ để ứng phó với tình trạng lây nhiễm virus Corona mới, tiền mặt và các vật phẩm liên quan đến dịch bệnh được phép khấu trừ toàn bộ khi tính thu nhập chịu thuế, vì vậy công ty A và B. Các lợi ích về thuế có thể được khấu trừ toàn bộ 2. Doanh nghiệp, cá nhân trực tiếp tặng các vật dụng dùng để ứng phó với dịch bệnh viêm phổi do virus Corona chủng mới cho các nguồn lực có trách nhiệm thực hiện nhiệm vụ phòng, chống dịch bệnh được phép khấu trừ toàn bộ khi tính thu nhập chịu thuế. Ông C có thể được hưởng đầy đủ các quyền lợi về thuế. Tuy nhiên, khi xử lý các vấn đề khấu trừ trước thuế, phải xuất trình thư chấp nhận quyên góp do bệnh viện cấp để làm bằng chứng."
