course_id,text,filtered_text,count,text_vi
C_948428,新立法法生效后税收法定原则在我国基本确立我国税法将深受影响根据立法法的规定我国新税种的设立必须由全国人大通过立法进行新税设立后税率的调整新税的征收管理等基本问题也应由全国人大通过修改法律实现我们需要逐步废止除个人所得税企业所得税和车船税之外其余15种税所依据的行政法规并由全国人大以法律重新确定每种税的所有要素,新立法法生效税收法定原则我国基本确立我国税法深受影响立法法规定我国新税种设立必须全国人大立法进行新税设立税率调整新税征收管理基本问题应全国人大修改法律实现需要废止个人所得税企业所得税车船税之外15种税行政法规全国人大法律重新确定每种税要素,1.0,"Sau khi luật thuế mới có hiệu lực, nguyên tắc thuế luật định đã được hình thành cơ bản ở nước ta Luật thuế nước ta sẽ bị ảnh hưởng sâu sắc. Theo quy định của luật pháp, việc xây dựng các loại thuế mới ở nước ta phải được luật hóa. do Quốc hội Nhân dân điều chỉnh mức thuế sau khi ban hành thuế mới, việc thu và quản lý các loại thuế mới và các vấn đề cơ bản khác cũng phải đạt được bằng cách sửa đổi luật thông qua Quốc hội. Chúng ta cần phải bãi bỏ dần dần. quy định hành chính dựa trên 15 loại thuế còn lại trừ thuế thu nhập cá nhân, thuế thu nhập doanh nghiệp và thuế phương tiện, tàu thuyền, đồng thời yêu cầu Quốc hội xác định lại tất cả các thành phần của từng loại thuế theo luật."
C_948428,我认为第一条不妥当因为m公司所购进的一批维护保养原材料取得的是增值税普通发票所以我认为这05万元的增值税税额不应该被冲减第二条没有问题,认为第一条妥当m公司购进一批维护保养原材料取得增值税普通发票认为05万元增值税税额应该冲减第二条没有问题,1.0,Tôi cho rằng trường hợp thứ nhất không phù hợp vì lô vật tư bảo trì do Công ty M mua nhận được hóa đơn VAT thông thường nên tôi cho rằng số tiền thuế giá trị gia tăng 50.000 NDT không được bù trừ.
C_948428,我认为不得当第一点109万和1308万是含税销售额所以计算税的时候以109万应该是109919第二点载明增值税税额为05万元这一项不应该冲减,认为第一点109万1308万是含税销售额计算税109万应该109919第二点载明增值税税额05万元一项应该冲减,1.0,"Tôi không nghĩ sẽ phù hợp khi coi điểm đầu tiên 1,09 triệu và 13,08 triệu là doanh thu đã bao gồm thuế, vì vậy khi tính thuế, 1,09 triệu phải là 109919. Điểm thứ hai nêu rõ số tiền thuế giá trị gia tăng là 50.000 nhân dân tệ. Mục này không nên được khấu trừ."
C_948428,1中应该用10919926来计算因为109万是含税销售额应该先计算出不含税的销售额10919另外增值税普通发票上载明增值税税额为05万元取得的是增值税普通发票这05万元不能被抵扣2我认为没有问题,1应该10919926计算109万是含税销售额应该先计算出不含税销售额10919增值税普通发票载明增值税税额05万元取得增值税普通发票05万元不能抵扣2认为没有问题,2.0,"Trong 1, 10919926 nên được sử dụng để tính toán vì 1090.000 là doanh thu đã bao gồm thuế. Trước tiên, bạn nên tính doanh số chưa bao gồm thuế của 10919. Ngoài ra, hóa đơn VAT thông thường ghi rằng số tiền thuế VAT là 050.000 nhân dân tệ. Hóa đơn VAT thông thường là 05. Không thể khấu trừ mười nghìn nhân dân tệ2 Tôi nghĩ không có vấn đề gì"
C_948428,现在的个人所得税法中没有实行全额累进税率都实行超额累进税率历史上曾经实行过全额累进正式逐渐认识到其不公平所以废除了,现在个人所得税法没有实行全额累进税率实行超额累进税率历史曾经实行全额累进正式逐渐认识公平废除,1.0,"Luật thuế thu nhập cá nhân hiện hành không thực hiện thuế suất lũy tiến đầy đủ mà thực hiện thuế suất lũy tiến quá mức. Trong lịch sử, thuế suất lũy tiến đầy đủ dần dần được thừa nhận là không công bằng nên đã bị bãi bỏ."
C_948428,目前的个人所得税法中都实行的是超额累进税率正是认识到全额累进税率的不公平才逐渐将之废除了,目前个人所得税法实行超额累进税率认识全额累进税率公平逐渐废除,1.0,"Luật thuế thu nhập cá nhân hiện hành thực hiện thuế suất lũy tiến quá mức, chính vì sự bất công của thuế suất lũy tiến toàn phần mà nó đã dần được bãi bỏ."
C_948428,我认为第一问不对应当计算不含税销售额计算得出为10919税额为109199增值税税额不应冲减第二条处理是正确的,认为第一问不对应当计算不含税销售额计算得出10919税额109199增值税税额不应冲减第二条处理正确,1.0,Tôi nghĩ câu hỏi đầu tiên sai. Doanh số bán hàng không bao gồm thuế phải được tính là 10919. Số tiền thuế là 109199. Số tiền thuế giá trị gia tăng không được bù đắp. Cách xử lý thứ hai là đúng.
C_948428,税收是国家组织财政收入的重要途径是国家按照法律规定向经济单位百和个人无偿征收财物的一种形式一2019年1月1日起施行了个人所得税改革起征点上调一定程度上缩小了社会贫富差距优化了市场资源合理配置二将工资薪金劳务报酬稿酬和特许权使用费这4项个人经常发生的主要所得项目并入综合征税范围平衡不同劳动性所得的纳税人的税收负担起到了调节收入分配的作用将侧重点放到教育医疗健康等民生问题有针对性地缓解民生压力使得社会长远稳定的发展此次个税改革维护了国家经济的健康发展,组织 无偿 征收 起 施行 上调 缩小 发生 所得 并入 征税 平衡 不同 所得 负担 起到 收入 作用 放到 健康 缓解 稳定 维护 健康,1.0,"Thuế là một phương thức quan trọng để nhà nước tổ chức thu tài chính. Đây là hình thức nhà nước thu miễn phí tài sản của các đơn vị kinh tế và cá nhân theo quy định của pháp luật. Việc tăng điểm ngưỡng đã thu hẹp tác động xã hội ở một mức độ nhất định, khoảng cách giàu nghèo tối ưu hóa việc phân bổ hợp lý các nguồn lực thị trường, bao gồm tiền lương, tiền công, thù lao lao động, tiền bản quyền và nhượng quyền thương mại. Bốn khoản thu nhập cá nhân chính thường xuyên xảy ra được tích hợp vào phạm vi thuế toàn diện để cân bằng gánh nặng thuế của người nộp thuế với thu nhập lao động khác nhau và đóng vai trò điều tiết phân phối thu nhập. Trọng tâm là các vấn đề sinh kế của người dân như giáo dục, y tế và sức khỏe. , và là mục tiêu. Cải cách thuế cá nhân này đã giảm bớt một cách hiệu quả áp lực lên sinh kế của người dân và tạo điều kiện cho xã hội phát triển lâu dài và ổn định. Cải cách thuế cá nhân này đã duy trì sự phát triển lành mạnh của nền kinh tế quốc gia."
C_948428,我认为m公司税务处理都不妥当因为增值税是价外税1和2这种用含税收入直接乘税率的算法就是错误的,认为m公司税务处理妥当增值税价外税12这种税收入直接税率算法错误,1.0,Tôi cho rằng cách xử lý thuế của Công ty M là không phù hợp vì thuế giá trị gia tăng là thuế giá trị gia tăng 1 và 2. Thuật toán nhân trực tiếp thuế suất với thu nhập đã bao thuế này là sai.
C_948428,市场的规律会使资源源源不断地投向东部发达地区税收加转移支付可以把一部分资源投入到对于落后地区的建设之中增加当地人的收入,市场规律资源源源不断投向东部发达地区税收加转移支付一部分资源投入落后地区建设之中增加当地人收入,1.0,Quy luật thị trường sẽ khiến nguồn lực không ngừng được đầu tư vào các khu vực phát triển ở phía Đông. Thuế và các khoản chuyển nhượng có thể đầu tư một phần nguồn lực vào việc xây dựng các khu vực lạc hậu nhằm tăng thu nhập cho người dân địa phương.
C_948428,第一问不对109万为含税销售额应该先计算出不含税的销售额再计算税额且05w元增值税税额不应冲减,第一问不对109万为含税销售额应该先计算出不含税销售额计算税额05w元增值税税额不应冲减,1.0,"Câu hỏi đầu tiên sai. 1,09 triệu là doanh số bán hàng đã bao gồm thuế. Doanh số bán hàng chưa bao gồm thuế phải được tính trước và sau đó là số tiền thuế giá trị gia tăng 0,5 triệu nhân dân tệ."
C_948428,第一问欠妥109万是含税销售额第一问中应该用不含税的销售额而非直接乘以税率增值税普通发票不能被抵扣m公司当月增值税应纳税额1091992664w第二问正确,第一问欠妥109万是含税销售额第一问中应该不含税销售额直接乘以税率增值税普通发票不能抵扣m公司当月增值税应纳税额1091992664w第二问正确,1.0,"Trong câu hỏi đầu tiên, số tiền bán hàng còn thiếu là 1,09 triệu đã bao gồm thuế. Trong câu hỏi đầu tiên, nên sử dụng doanh số bán hàng chưa bao gồm thuế thay vì nhân trực tiếp thuế suất VAT. số tiền công ty m phải trả trong tháng hiện tại là 1091992664w Câu hỏi thứ hai đúng."
C_948428,第一问不妥当因为109万元是含税价格应该计算出不含税价格来进行增值税计算另外05万元不应计入进项税进行抵扣第二问也应计算出1308万元的不含税价格来进行计算,第一问妥当109万元含税价格应该计算出不含税价格进行增值税计算05万元应计入进项税进行抵扣第二问应计算出1308万元不含税价格进行计算,2.0,"Câu hỏi đầu tiên là không phù hợp vì giá 1,09 triệu nhân dân tệ đã bao gồm thuế. Giá chưa bao gồm thuế phải được tính để tính thuế VAT. 50.000 nhân dân tệ còn lại không được tính vào thuế đầu vào để khấu trừ. giá không chính xác 13,08 triệu nhân dân tệ Tính giá bao gồm thuế."
C_948428,1两者的主要区别在于工资薪金存在雇佣关系劳务报酬不存在2提高高收入群体所得税税率提高征税起点,1主要区别工资薪金存在雇佣关系劳务报酬存在2提高高收入群体所得税税率提高征税起点,1.0,"1 Sự khác biệt chính giữa hai bên là có mối quan hệ việc làm về tiền lương và tiền công, trong khi tiền công lao động không tồn tại. 2 Tăng thuế suất thuế thu nhập đối với các nhóm thu nhập cao và tăng điểm khởi đầu đánh thuế."
C_948428,税法的变动在于这些方面1适当提高基本扣除标准将综合收益基本扣除费用由原来的3500元月提高到5000元月2首次设立专项附加扣除3调整优化个人所得税税率结构根据改革前工资性收入345七级超额累进税率扩大31020三个低税率缩小25税率303545三个高税率不变增加个人所得税有利于中等收入群体的增长使实际经济效益向中低收入者倾斜与以往单纯提高个税起征点的个税改革相比这次的差额是在提高个税起征点的基础上增加了六项专项附加扣除增加了子女教育继续教育重病医疗住房贷款利息住房租金赡养老人等意味着计税模式发生了重大改革这和我们的生活息息相关减轻中低收入群体的纳税负担,适当 提高 扣除 扣除 提高 设立 附加 扣除 收入 累进税 率 扩大 低 缩小 高 不变 增加 有利于 收入 增长 倾斜 单纯 提高 相比 提高 增加 附加 扣除 增加 继续 赡养 意味着 发生 重大 减轻 负担,1.0,"Những thay đổi trong luật thuế nằm ở những khía cạnh sau: 1. Nâng cao tiêu chuẩn khấu trừ cơ bản một cách thích hợp và tăng mức khấu trừ cơ bản cho thu nhập toàn diện từ 3.500 nhân dân tệ mỗi tháng ban đầu lên 5.000 nhân dân tệ mỗi tháng 2. Lần đầu tiên thiết lập các khoản khấu trừ bổ sung đặc biệt. 3. Điều chỉnh và tối ưu hóa cơ cấu thuế suất thuế thu nhập cá nhân dựa trên thu nhập tiền lương trước cải cách 345 7. Mở rộng mức thuế lũy tiến lũy tiến 31020, giảm ba mức thuế suất thấp, giảm thuế suất 25, 303545. thuế suất cao không thay đổi, việc tăng thuế thu nhập cá nhân có lợi Sự tăng trưởng của nhóm thu nhập trung bình đã nghiêng lợi ích kinh tế thực tế về phía người có thu nhập thấp và trung bình. So với cuộc cải cách thuế cá nhân trước đây chỉ đơn giản là nâng ngưỡng thuế cá nhân, điểm khác biệt lần này là sáu dự án đặc biệt đã được bổ sung. cơ sở nâng ngưỡng thuế cá nhân. Các khoản khấu trừ bổ sung bao gồm giáo dục trẻ em, giáo dục thường xuyên, bệnh hiểm nghèo, điều trị y tế, lãi vay mua nhà, tiền thuê nhà, hỗ trợ người già, v.v. Điều này có nghĩa là mô hình tính thuế đã trải qua những cải cách lớn, liên quan chặt chẽ đến cuộc sống của chúng ta, giảm gánh nặng thuế cho các nhóm thu nhập thấp và trung bình."
C_948428,在经济低迷增2113速放缓时采用积极的财政5261政策刺激经济发展减税降费可以降低企业特别是中小4102企业经营性成本降低企业1653税负增强企业发展活力通过结构性减税还可以对一些科创型企业内高新技术行业进行扶持容推动其发展,经济低迷增2113速放缓采用积极财政5261政策刺激经济发展减税降费降低企业特别中小4102企业经营性成本降低企业1653税负增强企业发展活力结构性减税科创型企业高新技术行业进行扶持容推动发展,1.0,"Khi nền kinh tế suy thoái và tốc độ tăng trưởng chậm lại, các chính sách tài khóa chủ động được áp dụng nhằm kích thích phát triển kinh tế có thể giúp giảm chi phí hoạt động của doanh nghiệp, đặc biệt là doanh nghiệp vừa và nhỏ, giảm gánh nặng thuế doanh nghiệp. , và nâng cao sức sống của sự phát triển doanh nghiệp. Cắt giảm thuế cơ cấu cũng có thể Các ngành công nghệ cao của một số doanh nghiệp dựa trên đổi mới khoa học và công nghệ hỗ trợ để thúc đẩy sự phát triển của họ."
C_948428,1新个税下工资薪金和劳务报酬计税和征收范围都是有区别的工资薪金是指个人因任职或者受雇取得的工资薪金奖金等与任职或者受雇有关的其他所得劳务报酬所得是指个人从事劳务取得的所得通过从事技术服务介绍服务经纪服务代办服务等劳务取得的所得2可以把边际税率定得高一些让高收入者承担更多的税收负担为社会多做贡献同时上调征税起点降低中底层人民的生活压力促进社会平衡,1新个税下工资薪金劳务报酬计税征收范围区别工资薪金指个人任职受雇取得工资薪金奖金任职受雇所得劳务报酬所得指个人从事劳务取得所得从事技术服务介绍服务经纪服务代办服务劳务取得所得2边际税率定得高高收入者承担税收负担社会贡献上调征税起点降低底层人民生活压力促进社会平衡,1.0,"1 Theo thuế thu nhập cá nhân mới, phạm vi tính và thu thuế đối với tiền lương, tiền công và tiền công lao động là khác nhau. Thu nhập từ việc làm hoặc tiền công của người đó là Thu nhập mà một cá nhân kiếm được từ việc thực hiện các dịch vụ lao động. Đối với thu nhập từ các dịch vụ như dịch vụ giới thiệu dịch vụ kỹ thuật, dịch vụ môi giới, dịch vụ đại lý2, thuế suất cận biên có thể được ấn định cao hơn để cho phép người có thu nhập cao chịu nhiều gánh nặng thuế hơn và đóng góp nhiều hơn cho xã hội. điểm khởi đầu cho việc đánh thuế sẽ được nâng lên nhằm giảm mức sống của người dân có thu nhập trung bình và thấp. Căng thẳng thúc đẩy cân bằng xã hội."
C_948428,个税起征点的不断上调表现出而高收入者税率没有下调增加反避税措施等措施促进了我国社会经济的健康发展和社会公平,税起征点不断上调表现出而高收入者税率没有下调增加反避税措施措施促进我国社会经济健康发展社会公平,1.0,Việc ngưỡng thuế thu nhập cá nhân liên tục tăng cho thấy mức thuế dành cho người có thu nhập cao vẫn chưa được hạ xuống và các biện pháp như tăng biện pháp chống trốn thuế đã thúc đẩy nền kinh tế xã hội và công bằng xã hội nước ta phát triển lành mạnh.
C_948428,第一条不妥当因为m公司所购进的一批维护保养原材料取得的是增值税普通发票所以这05万元的增值税税额不应该被减掉第二条妥当,第一条妥当m公司购进一批维护保养原材料取得增值税普通发票05万元增值税税额应该减掉第二条妥当,1.0,"Điều 1 không phù hợp vì lô vật tư bảo trì do Công ty M mua nhận được hóa đơn VAT thông thường nên không được khấu trừ số thuế giá trị gia tăng 0,5 triệu nhân dân tệ. Điều 2 là phù hợp."
C_948428,第一条不妥当原因增值税应该计算不含税销售额此外05万元的增值税税额是开的增值税普通发票不能扣减因此m公司当月增值税应纳税额10919926第二条是妥当的,第一条妥当原因增值税应该计算不含税销售额05万元增值税税额开增值税普通发票不能扣减m公司当月增值税应纳税额10919926第二条妥当,1.0,"Điều 1 không phù hợp vì VAT phải được tính trên doanh thu chưa bao gồm thuế. Ngoài ra, số tiền VAT 50.000 nhân dân tệ được phát hành dưới dạng hóa đơn VAT chung và không thể được khấu trừ. Do đó, thuế giá trị gia tăng mà Công ty M phải nộp cho tháng hiện tại. là 10.919.926 thì Điều 2 là phù hợp."
C_948428,第一条是不正确的应纳税额1099192605第二问正确,第一条正确应纳税额1099192605第二问正确,1.0,Câu đầu tiên sai. Số thuế phải nộp là 1099192605. Câu thứ hai đúng.
C_948428,在社会主义市场经济条件下市场对资源配置起主导作用但市场配置资源也有它的局限性可能出现市场失灵如无法提供部分公共产品外部效应自然垄断等这时就有必要通过税收保证公共产品的提供以税收纠正外部效应以税收配合价格调节具有自然垄断性质的企业和行业的生产使资源配置更加有效,社会主义市场经济条件市场资源配置主导作用市场配置资源局限性可能出现市场失灵无法提供部分公共产品外部效应自然垄断必要税收保证公共产品提供税收纠正外部效应税收配合价格调节具有自然垄断性质企业行业生产资源配置更加有效,1.0,"Trong điều kiện nền kinh tế thị trường xã hội chủ nghĩa, thị trường đóng vai trò chủ đạo trong việc phân bổ nguồn lực, tuy nhiên việc phân bổ nguồn lực theo thị trường cũng có những hạn chế nhất định, thất bại thị trường có thể xảy ra như không có khả năng cung cấp một số hàng hóa công, tác động từ bên ngoài, độc quyền tự nhiên. , v.v. Trong trường hợp này, cần đảm bảo cung cấp hàng hóa công thông qua thuế. Sử dụng thuế để điều chỉnh các tác động bên ngoài để điều tiết hoạt động sản xuất của các doanh nghiệp và các ngành có độc quyền tự nhiên nhằm phân bổ nguồn lực hiệu quả hơn."
C_948428,税收作为国家宏观调控的重要手段通过制定税法以法律的形式确定国家与纳税人之间的利益分配关系调节社会成员的收入水平调整产业结构和社会资源的优化配置使之符合国家的宏观经济政策同时以法律的平等原则公平经营单位和个人的税收负担鼓励平等竞争为市场经济的发展创造了良好的条件就个人所得税而言交个人所得税可以增加国家财政收入保证稳定的财政收入调节收入分配有助于实现社会公平但是随着经济发展社会贫富差距加大等问题将会逐步显现有可能成为影响社会稳定的负面因素所以2018年经十三届全国人大常委会第五次会议表决通过了关于修改个人所得税法的决定个税起征点提高至5000元据财政部测算就业总人数中纳税人占的比重将由过去的44下降到15这就意味着有很大一批人不用再缴纳个税国家进行了调控此外此次个税法修改还体现出以民为本的理念修正案草案中增加了对子女教育大病医疗等多个专项扣除这会让老百姓实现真正的减负这项税法变动有利于促进我国社会经济的健康发展和社会公平,重要 制定 确定 配置 平等 负担 鼓励 创造 交 增加 保证 稳定 收入 有助于 实现 加大 会 显现 可能 成为 稳定 表决 修改 决定 提高 就业 占 下降 意味着 很大 不用 缴纳 进行 修改 体现 出 增加 扣除 会 实现 减负 有利于 促进 健康,1.0,"Thuế, với vai trò là phương tiện kiểm soát vĩ mô quốc gia quan trọng, quyết định mối quan hệ phân bổ lợi ích giữa nhà nước và người nộp thuế dưới hình thức pháp luật thông qua việc xây dựng luật thuế, điều tiết mức thu nhập của các thành viên xã hội, điều chỉnh cơ cấu ngành và tối ưu hóa việc phân bổ. các nguồn lực xã hội, phù hợp với chính sách kinh tế vĩ mô của đất nước. Điều hành các đơn vị, cá nhân một cách công bằng trên nguyên tắc bình đẳng trước pháp luật. Gánh nặng thuế khuyến khích sự cạnh tranh bình đẳng và tạo điều kiện tốt cho sự phát triển của nền kinh tế thị trường. Về mặt thuế thu nhập cá nhân, việc nộp thuế thu nhập cá nhân có thể làm tăng nguồn thu tài chính quốc gia và đảm bảo nguồn thu tài chính ổn định. Tuy nhiên, cùng với sự phát triển kinh tế, nghèo đói xã hội Các vấn đề như khoảng cách giàu nghèo ngày càng gia tăng sẽ dần xuất hiện và có thể trở thành Nhằm giảm thiểu các yếu tố tiêu cực ảnh hưởng đến ổn định xã hội, năm 2018, kỳ họp lần thứ 5 Ủy ban Thường vụ Quốc hội khóa XIII đã bỏ phiếu và thông qua quyết định sửa đổi Luật Thuế thu nhập cá nhân. Ngưỡng thuế thu nhập cá nhân được nâng lên 5.000. nhân dân tệ Theo tính toán của Bộ Tài chính về tổng số người có việc làm, thuế suất Tỷ lệ người dân sẽ giảm từ 44 trước đây xuống còn 15. Điều này có nghĩa là có. Một số lượng lớn người dân không còn phải nộp thuế thu nhập cá nhân. Ngoài ra, việc sửa đổi luật thuế thu nhập cá nhân cũng phản ánh quan điểm hướng tới người dân. giáo dục trẻ em, bệnh hiểm nghèo, điều trị y tế, v.v. Điều này sẽ cho phép người dân bình thường nhận ra Sự thay đổi luật thuế này thực sự giảm bớt gánh nặng, có lợi cho việc thúc đẩy sự phát triển lành mạnh của nền kinh tế xã hội và công bằng xã hội của đất nước tôi."
C_948428,1是否存在雇佣关系2提高个税起征点挺高高收入人群个人所得税税率,1是否存在雇佣关系2提高税起征点挺高高收入人群个人所得税税率,1.0,1. Có quan hệ việc làm hay không 2. Nâng ngưỡng thuế thu nhập cá nhân và thuế suất thuế thu nhập cá nhân đối với người có thu nhập cao.
C_948428,第一问不对应纳税额1099192605第二问正确,第一问不对应纳税额1099192605第二问正确,1.0,Câu đầu tiên không tương ứng với số thuế 1099192605 và câu thứ hai đúng
