course_id,text,filtered_text,count
C_948282,合成橡胶的分类方法很多按成品状态可分为液体橡胶如端羟基聚丁二烯固体橡胶乳胶和粉末橡胶等按橡胶制品来形成过程可分为热自塑性橡胶如可反复加工成型的三嵌段热塑性丁苯橡胶硫化型橡胶需经硫化才能制得成品大多数合成橡胶属此类按生胶充填的其他非橡胶成分又可分为百充油母胶充炭黑母胶和充木质素母胶实际应用中又按使用特性分为通用型橡胶和特种橡胶两大类通用型橡胶指可以部分或全部代替天然橡胶使用的橡胶度如丁苯橡胶异戊橡胶顺丁橡胶等主要用于制造各种轮胎及一般工业橡胶制品特种橡胶是指具有耐高温耐油耐臭氧耐老化和高气密性等特问点的橡胶常用的有硅橡胶各种氟橡胶答聚硫橡胶氯醇橡胶丁腈橡胶聚丙烯酸酯橡胶聚氨酯橡胶和丁基橡胶等主要用于要求某种特性的特殊场合,分为 如 端 固体 形成 分为 热 反复 嵌 制得 属 充填 分为 应用 使用 分为 代替 使用 用于 制造 具有 高 问 答聚 聚 用于 要求 特殊,1.0
C_948282,考研加油,考研加油,1.0
C_948282,增速期胶束不断减少乳胶粒不断增加直到胶束消失恒速期胶粒不断变大单体液滴数目不变体积不断减降速期单体液滴消失只剩胶粒且数目恒定胶粒内单体浓度逐渐下降,增速期胶束不断减少乳胶粒不断增加胶束消失恒速期胶粒不断变单体液滴数目不变体积不断减降速期单体液滴消失剩胶粒数目恒定胶粒单体浓度逐渐下降,1.0
C_948282,线性缩聚为22官能团体系体型缩聚则至少有一方官能度大于3且另一方大于等于2,线性缩聚22官能团体系体型缩聚至少一方官能度大于3另一方大于等于2,1.0
C_948282,r0时只进行共聚r在0到1时利于共聚r为1时共聚和自聚概率相同r大于1时有利于自聚r为无限大时只进行自聚,r0进行共聚r01利于共聚r1共聚自聚概率相同r大于1有利于自聚r无限大进行自聚,2.0
C_948282,系统命名法习惯命名法商品命命法,系统命名法习惯命名法商品命命法,1.0
C_948282,r0只能进行共聚r1时自聚共聚相同r1有利于自聚r1有利于共聚r正无穷只能自聚,r0只能进行共聚r1时自聚共聚相同r1有利于自聚r1有利于共聚r正无穷只能自聚,1.0
C_948282,发生聚合反应时单体很快变成二聚体三聚体等即单体转化率很高但聚合过程很慢所以转化率对聚合度影响不大但反应程度是参加反应的官能团所占比例更能反应聚合度,发生聚合反应单体很快变成二聚体三聚体单体转化率高聚合过程慢转化率聚合度影响不大反应程度参加反应官能团占比例更能反应聚合度,1.0
C_948282,本体聚合聚合热的排除问题溶液聚合溶剂的选择悬浮聚合分散剂的选择以及用量,本体聚合聚合热排除问题溶液聚合溶剂选择悬浮聚合分散剂选择用量,4.0
C_948282,系统习惯,系统习惯,1.0
C_948282,r为零时聚合反应是异种单元共聚r为一时共聚和自聚概率一样r大于一时有利于自聚,r零时聚合反应异种单元共聚r一时共聚自聚概率r大于一时有利于自聚,1.0
C_948282,常规命名法和系统命名法,常规命名法系统命名法,1.0
C_948282,通过共聚合和改变聚合物结构改进聚合物诸多性能测定单体自由基活性进一步了解单体与反应活性之间的关系,共聚合改变聚合物结构改进聚合物诸多性能测定单体自由基活性进一步了解单体反应活性之间关系,1.0
C_948282,根据临界胶束浓度和亲水亲油平衡值选择合适的乳化剂浓度,临界胶束浓度亲水亲油平衡值选择合适乳化剂浓度,4.0
C_948282,冰糖葫芦肉串珍珠手链,冰糖葫芦肉串珍珠手链,1.0
C_948282,习惯命名法系统命名法商品命名法系统命名法较为繁琐,习惯命名法系统命名法商品命名法系统命名法较为繁琐,1.0
C_948282,线性缩聚是22体系或2体系缩合而成体型缩聚是由23体系或24体系缩合而成线性缩聚产物为线性体型缩聚形成的大分子向多个方向增长,线性缩聚22体系2体系缩合而成体型缩聚23体系24体系缩合而成线性缩聚产物线性体型缩聚形成大分子多个方向增长,3.0
C_948282,多骨诺米牌放鞭炮织围巾,多骨诺米牌放鞭炮织围巾,2.0
C_948282,冰糖葫芦的制作过程放鞭炮多米诺骨牌,冰糖葫芦制作过程放鞭炮多米诺骨牌,5.0
C_948282,偶氮类可以测溢出的氮气量来计算过氧类可以用碘量法测得,偶氮类测溢出氮气量计算过氧类碘量法测,2.0
C_948282,乳化剂的选择参照cmc和hlb的指标在一般乳液聚合时乳化剂的浓度总超过cmc值23数量级,乳化剂选择参照cmchlb指标乳液聚合乳化剂浓度总超过cmc值23数量级,1.0
C_948282,习惯命名法商品命名法系统命名法系统命名法较为繁琐因此使用越来越少,习惯命名法商品命名法系统命名法系统命名法较为繁琐使用越来越少,2.0
C_948282,轮胎塑料袋手机壳,轮胎塑料袋手机壳,1.0
C_948282,聚氯乙烯聚丙烯聚苯乙烯聚乙烯等,聚氯乙烯聚丙烯聚苯乙烯聚乙烯,1.0
C_948282,线性缩聚是22或者官能度体系线性方向缩聚体型缩聚必须是官能度均大于或等于2的单体之间反应产物较线性缩聚产物而言分子体积更大更复杂,线性缩聚22官能度体系线性方向缩聚体型缩聚必须官能度均大于等于2单体之间反应产物线性缩聚产物分子体积更大复杂,1.0
C_948282,线型缩聚的单体必须是二二或二官能度体系反映单体不易成环还少副反应体型缩聚的单体官能度至少有一个单体含两个以上官能度形成大分子像三个方向增长,线型缩聚单体必须官能度体系反映单体不易成环少副反应体型缩聚单体官能度至少单体两个官能度形成大分子三个方向增长,2.0
C_948282,鞭炮多米诺骨牌织毛衣,鞭炮多米诺骨牌织毛衣,1.0
C_948282,线性缩聚是22官能团体系和2官能团体系在线形方向进行缩聚232433等官能团体系除了按线形方向缩聚外侧基也能缩聚先形成支链进一步形成体形结构,线性缩聚22官能团体系2官能团体系线形方向进行缩聚232433官能团体系线形方向缩聚外侧基缩聚先形成支链进一步形成体形结构,2.0
C_948282,多米诺骨牌放鞭炮毛衣,多米诺骨牌放鞭炮毛衣,1.0
C_948282,纤维塑料涂料橡胶,纤维塑料涂料橡胶,1.0
C_948282,本体聚合容易出现自动加速现象溶液聚合溶剂的选择很重要因为不适合的溶剂它的转移速率常数较大悬浮聚合对聚合物种类和颗粒有要求,本体聚合容易出现自动加速现象溶液聚合溶剂选择重要适合溶剂转移速率常数较大悬浮聚合聚合物种类颗粒要求,2.0
C_948282,carothers预测偏大flory预测偏小,carothers预测偏大flory预测偏小,1.0
C_948282,衣服,衣服,1.0
C_948282,升高温度降低压强,升高温度降低压强,1.0
C_948282,单体转化率对于逐步聚合没有太大影响因为它会有各种中间产物的生成而反应程度与平衡聚合度有一定联系根据官能团的减少量xn11p,单体转化率聚合没有太影响它会中间产物生成反应程度平衡聚合度一定联系官能团减少量xn11p,1.0
C_948282,加入特定的物质参与共聚达到相应的性能,加入特定物质参与共聚达到相应性能,15.0
C_948282,成核期胶束不断减少胶粒不断曾都是单体液滴数不变恒速期胶束消失乳胶粒和单体液滴不变单体夜滴中的单体逐渐减少降速期单体液滴消失只有乳胶粒聚合消耗乳胶粒内部的单体,成核期胶束不断减少胶粒不断单体液滴数不变恒速期胶束消失乳胶粒单体液滴不变单体夜滴单体逐渐减少降速期单体液滴消失乳胶粒聚合消耗乳胶粒内部单体,1.0
C_948282,r0只能与一种单体共聚r1子增长和交叉增长难易程度相同,r0只能单体共聚r1子增长交叉增长难易程度相同,1.0
C_948282,缩聚早期单体很快消失转化率很高而分子量逐步增加所以转化率无实际意义改用反应基团的反应程度来表述深度更确切,缩聚早期单体很快消失转化率高分子量增加转化率实际意义改用反应基团反应程度表述深度确切,1.0
C_948282,通过乳化剂的作用亲水基团和亲油基团组成的疏水内腔将油状的物质包裹起来然后通过水洗涤去除油污,乳化剂作用亲水基团和亲油基团组成疏水内腔油状物质包裹起来水洗涤去除油污,1.0
C_948282,r0只能共聚r1都可以r1有利于自聚,r0只能共聚r1r1有利于自聚,1.0
C_948282,线性缩聚是22官能度体系还有2官能度体系,线性缩聚22官能度体系2官能度体系,1.0
C_948282,塑料袋轮胎晴纶水管,塑料袋轮胎晴纶水管,1.0
C_948289,第一,第一,1.0
C_948289,商务英语案例分析2019秋非常好,商务英语案例分析2019秋非常,1.0
C_948289,商务英语案例分析2019秋非常好,商务英语案例分析2019秋非常,1.0
C_948289,商务英语案例分析2019秋非常好,商务英语案例分析2019秋非常,1.0
C_948289,商务英语案例分析2019秋非常好,商务英语案例分析2019秋非常,1.0
C_948289,商务英语案例分析2019秋非常好,商务英语案例分析2019秋非常,1.0
C_948289,商务英语案例分析2019秋非常好,商务英语案例分析2019秋非常,1.0
C_948289,商务英语案例分析2019秋非常好,商务英语案例分析2019秋非常,1.0
C_948289,商务英语案例分析2019秋非常好,商务英语案例分析2019秋非常,1.0
C_948289,商务英语案例分析2019秋非常好,商务英语案例分析2019秋非常,1.0
C_948289,商务英语案例分析2019秋非常好,商务英语案例分析2019秋非常,1.0
C_948289,商务英语案例分析2019秋非常好,商务英语案例分析2019秋非常,1.0
C_948289,实在听不懂英文,实在听不懂英文,1.0
C_948289,没有字幕的吗,没有字幕,1.0
C_948289,谢谢,谢谢,1.0
C_948289,讲的很棒,讲很棒,1.0
C_948289,没有字幕也没有翻译大家都听得懂吗,没有字幕没有翻译听得懂,1.0
C_948289,认真听一句话可以听懂三五个单词的然后就猜测意思吧呵呵,认真听一句话听懂三五个单词猜测意思,1.0
C_948296,多加练习身体舒展,多加练习身体舒展,1.0
C_948296,要注意后退路线和方向同时眼睛要平视前方,注意后退路线方向眼睛平视前方,1.0
C_948296,多练习使动作协调保持重心稳定,练习动作协调保持重心稳定,1.0
C_948296,前四排和后四排不同,前四排四排不同,3.0
C_948296,动作之间的衔接要流畅自然形式变化多样动作有节奏还要突出腰鼓的特点,动作之间衔接流畅自然形式变化多样动作节奏突出腰鼓特点,4.0
C_948296,脚抢动作不同,脚抢动作不同,1.0
C_948296,左侧腰腹,左侧腰腹,1.0
C_948296,由慢到快增强协调性,由慢快增强协调性,1.0
C_948296,弹跳步转身鼓脚下增加了弹跳步然后用脚尖碰地,弹跳步转身鼓脚下增加弹跳步脚尖碰地,3.0
C_948296,注意后退路线和方向眼睛好平视前方身体前倾各种收腹以小垫步动作向后排中心位置靠拢,注意后退路线方向眼睛平视前方身体前倾收腹以小垫步动作后排中心位置靠拢,1.0
C_948296,五到八拍不同两人面对面对称做有美感且有互动,五到拍不同两人面对面对称美感互动,1.0
C_948296,5到8拍不同,58拍不同,2.0
C_948296,当地群众传说早在秦汉时期腰鼓就被驻防将士视同刀枪弓箭一样不可少的装备遇到敌人突袭就击鼓报警传递讯息两军对阵交锋以击鼓助威征战取得胜利士卒又击鼓庆贺随着时间的流逝腰鼓从军事用途逐渐发展成为当地民众祈求神灵祝愿丰收欢度春节时的一种民俗性舞蹈从而使腰鼓具有更大的群众性但在击鼓的风格和表演上继续保留着某些秦汉将士的勃勃英姿,群众传说早秦汉时期腰鼓驻防将士视同刀枪弓箭不可少装备遇到敌人突袭击鼓报警传递讯息两军对阵交锋击鼓助威征战取得胜利士卒击鼓庆贺时间流逝腰鼓军事用途逐渐发展成为民众祈求神灵祝愿丰收欢度春节民俗性舞蹈腰鼓具有更大群众性击鼓风格表演继续保留秦汉将士勃勃英姿,1.0
C_948296,多练习注意手脚之间的联系,练习注意手脚之间联系,3.0
C_948296,节奏力度不同,节奏力度不同,9.0
C_948296,叫上动作有很大不同,动作很大不同,1.0
C_948296,由慢到快,由慢快,16.0
C_948296,脚上动作有很大不同,脚动作很大不同,13.0
C_948296,动作已缓连贯大方高低起伏,动作已缓连贯大方高低起伏,1.0
C_948296,臣妾做不到啊,臣妾不到,1.0
C_948296,需要动作协调才能体现动作的美感,需要动作协调体现动作美感,1.0
C_948296,鼓槌敲击鼓面的力量不同击打节奏不同,鼓槌敲击鼓面力量不同击打节奏不同,5.0
C_948296,队形的变化衔接的变化,队形变化衔接变化,1.0
C_948296,前后弓步改为左右弓步左右甩绸左右顺势敲打鼓面然后对称着变化,弓步改为左右弓步左右甩绸左右顺势敲打鼓面对称变化,1.0
C_948296,注意后退路线和方向身体前倾收腹含胸眼睛平视前方以小垫步动作向后排中心位置靠拢,注意后退路线方向身体前倾收腹含胸眼睛平视前方以小垫步动作后排中心位置靠拢,1.0
C_948296,队形的变化和衔接的流畅动作合理对应多变,队形变化衔接流畅动作合理对应多变,1.0
C_948296,1第58拍有很大的不同二两人面对面对称着来并且有互动,158拍有很大不同二两面对面对称互动,1.0
C_948296,先熟练手上动作再手脚结合慢动作重复跟着节奏进行练习,先熟练手上动作手脚结合慢动作重复跟着节奏进行练习,1.0
C_948296,安塞腰鼓更倾向于战争说一个倾向胳膊一个倾向退一个倾向表情,安塞腰鼓倾向战争倾向胳膊倾向退倾向表情,1.0
C_948296,可以在左手甩绸时右手趁机向下击打鼓面,左手甩绸时右手趁机向下击打鼓面,1.0
C_948296,第三拍应该注意背对背交叉第六拍时应注意踢腿腿的方向,第三拍应该注意背对背交叉第六拍时应注意踢腿腿方向,1.0
C_948296,交叉后一定要准确到达对方的位置交叉困难但节奏欢快有对称美,交叉一定准确到达位置交叉困难节奏欢快对称美,2.0
C_948296,多加练习使手脚协调动作有节奏衔接连贯步伐不要太大或太小保持身体稳定的基础上大方舒展,多加练习手脚协调动作节奏衔接连贯步伐不要太大太小保持身体稳定基础大方舒展,2.0
C_948296,多练习增加协调性,练习增加协调性,2.0
C_948296,小踮步是跑跳步的基础,踮步跑跳步基础,1.0
C_948296,第三排注意背对背交叉通过第六拍应注意踢腿方向,第三排注意背对背交叉第六拍应注意踢腿方向,1.0
C_948296,比较倾向于战争学说,比较倾向战争学说,1.0
C_948296,动作舒展大方自然有利注意第一个八拍第五拍的行进距离第七拍时两人背对背第二个八拍时落脚位置要准确,动作舒展大方自然有利注意第一个八拍第五拍行进距离第七拍时两人背对背第二个八拍落脚位置准确,1.0
C_948296,脚步动作不一样要多联系,脚步动作联系,1.0
C_948296,58不同两人面对面对称美,58不同两人面对面对称美,1.0
C_948296,注意后退路线和方向,注意后退路线方向,2.0
C_948296,左侧腹前,左侧腹前,43.0
C_948296,讲的好,讲,1.0
C_948296,对应编排注意衔接,对应编排注意衔接,1.0
C_948296,小踮步,踮步,1.0
C_948296,注意踢腿方向和迈步距离动作舒展大方,注意踢腿方向迈步距离动作舒展大方,1.0
C_948296,熟能生巧,熟能生巧,2.0
C_948296,弹跳步转身鼓脚下增加了弹跳步用脚尖弹地不同于缠腰鼓的用脚后跟弹地动作要娴熟自然,弹跳步转身鼓脚下增加弹跳步用脚尖弹地不同于缠腰鼓脚后跟弹地动作娴熟自然,3.0
C_948296,五至八拍十五至十八拍与一至四拍动作相同九至十一拍同一至三拍相同十二拍与十四拍与其他不同,五至拍十五十八拍一至拍动作相同九至十一拍同一拍相同十二拍十四拍不同,1.0
C_948296,各鼓点基本相同节奏欢快热情豪迈,鼓点基本相同节奏欢快热情豪迈,1.0
C_948296,多练习注意手脚联系,练习注意手脚联系,12.0
C_948296,队形变化和衔接流畅,队形变化衔接流畅,3.0
C_948296,塞腰鼓是流传在陕西省北部安塞县一带的一种民间广场群体艺术展现了陕北人民的一腔热血是陕北民间艺术中独特而具代表性的艺术形式它在长期流传过程中形成了粗犷豪放剽悍威武刚劲激昂气势磅礴浑厚雄壮威猛刚烈铿锵有力舞姿优美潇洒大方流畅飘逸快收猛放有张有弛群而不乱变化多端等特点安塞腰鼓融舞蹈武术体操打击乐吹奏乐民歌为一体集中表现了陕北人夺取胜利和丰收后的喜悦心情融合了黄土高原人憨厚实在乐观开朗的性格同时它是中华民族精神风貌的再现是黄河流域文化的组成部分因而它不仅深受广大群众的喜爱而且名扬海外堪称中国一绝和中国第一鼓安塞腰鼓从农村打到城市从黄土高原打向大江南北从农家小院打到天安门前从自编自演走向电影电视屏幕从农运会打到亚运会从陕北的穷山沟走上世界领奖台安塞腰鼓以它独特而精湛的艺术打遍全国冲出亚洲走向世界,塞 展现 独特 具 形成 粗犷 豪放 剽悍 刚劲 激昂 浑厚 雄壮 威猛 刚烈 优美 潇洒 流畅 飘逸 快 收 猛放 不乱 集中 表现 夺取 丰收 喜悦 憨厚 实在 乐观 再现 深受 喜爱 名扬 堪称 鼓 打向 走向 走上 独特 精湛 打遍,1.0
C_948296,不是靠近地面的为第一排鼓环后面穿鼓带时说的是上面为第一排鼓环,靠近地面第一排鼓环后面穿鼓带时说上面第一排鼓环,1.0
C_948296,两环鼓右端鼓带要绕过身体后方从左侧穿过后鼓环前鼓环四鼓环穿过第二排后鼓环前鼓环左手大拇指靠近鼓槌鼓头末端而右手小拇指和无名指间靠近末端鼓槌握法有利于鼓槌的固定,两环鼓右端鼓带绕过身体后方左侧穿过后鼓环前鼓环四鼓环穿过第二排后鼓环前鼓环左手大拇指靠近鼓槌鼓头末端右手小拇指无名指间靠近末端鼓槌握法有利于鼓槌固定,2.0
C_948296,交叉后一定要准确到达的位置节奏欢快有对称美,交叉一定准确到达位置节奏欢快对称美,1.0
C_948296,多练习注意手脚的联系动作要舒展大方,练习注意手脚联系动作舒展大方,1.0
C_948296,多练习孰能生巧,练习孰能生巧,1.0
C_948296,先掌握住基本动作由慢至快勤加练习肢体协调舒展,先掌握住基本动作由慢快勤加练习肢体协调舒展,1.0
C_948296,注意落脚方向,注意落脚方向,1.0
C_948296,注意方向和路线每一个八拍都要回到指定位置,注意方向路线八拍回到指定位置,1.0
C_948296,动作舒展大方自然有力注意第一个八拍第五个八拍进行的距离第七八拍是两个人背对背第二个八拍落脚位置要准确,动作舒展大方自然有力注意第一个八拍第五个八拍进行距离第七八拍两个背对背第二个八拍落脚位置准确,1.0
C_948296,脚下动作和手上力度不同,脚下动作手上力度不同,4.0
C_948296,左手甩绸缎右手顺势敲打鼓面对称着变化,左手甩绸缎右手顺势敲打鼓面对称变化,1.0
C_948296,要保证路线和方向准确动作要大方自然,保证路线方向准确动作大方自然,1.0
C_948296,注意交叉路线和踢腿位置的准确,注意交叉路线踢腿位置准确,2.0
C_948296,动作与动作间的衔接,动作动作间衔接,1.0
C_948296,背对背交叉,背对背交叉,3.0
C_948296,喜欢,喜欢,1.0
C_948296,人数队形不同交叉位置有差异但动作相同的人数队形不同交叉位置有差异但动作相同,人数队形不同交叉位置差异动作相同人数队形不同交叉位置差异动作相同,2.0
C_948296,1小踮步适用于转换各种步伐之间的过度2小踮步是跑跳步的基础小踮步熟练后对于练习跑步更容易上手,1踮步适用转换步伐之间过度2踮步跑跳步基础踮步熟练练习跑步容易手,1.0
C_948296,一交叉路线和到达位置要准确二第六拍时要注意踢腿方向一致,交叉路线到达位置准确第六拍时注意踢腿方向一致,2.0
C_948296,小踮步动作使动作较好地与接下来的动作连接起来使动作连贯优美行云流水一气呵成,踮步动作动作接下来动作连接起来动作连贯优美行云流水一气呵成,1.0
C_948296,动作要迅速准确符合节拍同时要大方自然,动作迅速准确符合节拍大方自然,1.0
C_948296,脚上动作和手上动作不同,脚动作手上动作不同,2.0
C_948296,队形编排注意斜街,队形编排注意斜街,1.0
C_948296,人数和队形变化不同,人数队形变化不同,1.0
C_948296,转身姿势和位置不同转身时要稳住自己的重心,转身姿势位置不同转身时要稳住重心,7.0
C_948296,动作舒展大方活泼有力,动作舒展大方活泼有力,1.0
C_948296,人数与队形变化不一样并且十字交叉还有原地缠腰过档鼓,人数队形变化十字交叉原地缠腰档鼓,2.0
C_948296,节奏力度的差异,节奏力度差异,1.0
C_948296,动作相同人数不同位置有差异,动作相同人数不同位置差异,1.0
C_948296,队形衔接,队形衔接,1.0
C_948296,人数队形的变化不同,人数队形变化不同,1.0
C_948296,人数与队形变化不一样并且十字交叉中还有原地的缠腰过裆鼓,人数队形变化十字交叉原地缠腰裆鼓,2.0
C_948296,动作规范大方,动作规范大方,1.0
C_948296,前后弓步改为左右马步左右甩绸左右顺势敲打鼓面然后对称着变化,弓步改为左右马步左右甩绸左右顺势敲打鼓面对称变化,4.0
C_948296,厉害啊,厉害,1.0
C_948296,不同在于红筹缠绕第二圈的时候我垂的姿势很重要也就打不上鼓面我的时候右手只右上方略高于头的位置全新小哥我这儿玩雪左手指左下测与身体45度夹角,不同红筹缠绕第二圈垂姿势重要鼓面右手右上方略高于头位置全新小哥玩雪左手指左下测身体45度夹角,1.0
C_948296,我更倾向于谭家营派因为他们的表演有一种以柔克刚的美感目前安塞腰鼓在安塞县主要有四大派别既真武洞谭家营沿河湾西河口这四大派别在表演上个有个的特色西河口派的表演特色主要体现在腿上西河口派在表演的过程中腿法较为突出打腰鼓时腿部变化花样较多且快速迅猛带有一股狠劲似乎要跺破地皮似的此外西河口派的鼓点花样多谭家营派的表演特色主要表现在腰上谭家营派表演腰鼓时腰部有一种以柔克刚的美感这些特色都是相对性的无专属性这与它的传播途径有很大关系安塞腰鼓起初称之为陕北腰鼓主要在绥德米脂榆林一带盛行后来由绥德米脂一带的人们传入安塞由于安塞人的腰鼓打的好人们逐渐的将陕北腰鼓改称为安塞腰鼓起初的安塞腰鼓依据安塞腰鼓的地域分布将其分南北两个派别北派的腰鼓动作由于距发源地绥德米脂榆林一带较近打法动作变异较小较正宗与传统多以基本动作马步缠腰为主南派由远离绥德米脂榆林在流传的过程中腰鼓动作的变异较大腰鼓动作也因此变得多样化起来到今天安塞腰鼓有原来的南北两大派别发展到四大派别这四大派别分别是谭家营西河口沿河湾和真武洞这四大派别在腰鼓的打法与动作上各有各的特色如谭家营派的腰鼓的特色主要表现在腰上西河口派的特色主要表现在腿上踢腿带鼓狠劲,倾向 表演 派别 派别 表演 派 表演 体现 派 表演 突出 带有 狠劲 跺破 派 表演 表现 表演 很大 称之为 盛行 传入 改称 分布 派别 近 打法 小 缠 为主 远离 较大 变得 起来 大 派别 派别 派别 派别 打法 表现 派 表现 踢腿 带鼓 狠劲,1.0
C_948296,队形变化和衔接变化,队形变化衔接变化,2.0
C_948296,人数队形不同交叉的位置也不一样,人数队形不同交叉位置,3.0
C_948296,脚上动作不同手上力度不同,脚动作不同手上力度不同,3.0
C_948296,动作舒展大方自然有力,动作舒展大方自然有力,7.0
C_948296,脚上动作不同,脚动作不同,32.0
C_948296,多加练习是动作更加协调有利于身体平衡,多加练习动作更加协调有利于身体平衡,1.0
C_948296,先右手再左手脚后跟四十五度保证动作更加稳定,先右手左手脚后跟四十五度保证动作更加稳定,1.0
C_948296,多加练习摆臂,多加练习摆臂,2.0
C_948296,多加练习身体舒展动作流畅,多加练习身体舒展动作流畅,1.0
C_948296,对象变化,对象变化,1.0
C_948296,两种转身鼓在第六排之后有很大不同主要是长腰360度转身鼓在第七拍时要以右腿为轴心顺时针旋转180度而缠腰180度转身鼓则收左脚弹踢右脚而缠腰360度转身鼓第六拍动作要注意把握好右脚落地的位置一边后面第七拍旋转时能更好的把握中心要迅速准确防止带来不必要动作,两种转身鼓在第六排之后很大不同主要长腰360度转身鼓在第七拍时右腿轴心顺时针旋转180度缠腰180度转身鼓则收左脚弹踢右脚缠腰360度转身鼓第六拍动作注意把握右脚落地位置一边后面第七拍旋转时能更好把握中心迅速准确防止带来不必要动作,1.0
