course_id,text,filtered_text,count
C_948209,自然辩证法从具体科学技术中吸取营养从具体科学技术认识上升到马克思主义普遍原理的一个中间环节联结马克思主义和科学技术的重要纽带,自然辩证法具体科学技术吸取营养具体科学技术认识上升马克思主义普遍原理中间环节联结马克思主义科学技术重要纽带,1.0
C_948209,自然辩证法是伟人留给我们的宝贵财富要好好学习,自然辩证法伟人留给宝贵财富好好学习,1.0
C_948209,从抽象到具体再从具体到抽象研究问题要注意方法与角度,抽象具体具体抽象研究问题注意方法角度,1.0
C_948209,系统自然观为正确认识和处理人与自然的关系提供了新的思维方式,系统自然观正确认识处理人与自然关系提供新思维方式,1.0
C_948209,人工自然需要遵循科学原理做到协调发展,人工自然需要科学原理做到协调发展,1.0
C_948209,坚持世界眼光国际标准中国特色高点定位坚持生态优先绿色发展坚持以人民为中心注重保障和改善民生,坚持世界眼光国际标准中国特色高点定位坚持生态优先绿色发展坚持人民中心注重保障改善民生,1.0
C_948209,我是张籽蕤,张籽蕤,4.0
C_948209,科学转换为生产力是对要素对结构来转化为生产力,科学转换生产力要素结构转化生产力,1.0
C_948209,我们在科学研究中要注意培养战略性思维从大局和战略高度出发认清所做的研究在战略层面的意义,科学研究中要注意培养战略性思维大局战略高度出发认清研究战略层面意义,1.0
C_948209,科学是人类社会活动的一个范畴它是一个团体而不是一个人,科学人类社会活动范畴团体,2.0
C_948209,思维方向求异思维结构灵活,思维方向求异思维结构灵活,1.0
C_948209,自然辩证法打卡学习,自然辩证法打卡学习,1.0
C_948209,总结的好马住学习,总结马住学习,1.0
C_948209,在分析问题时要有独立的思考和批判精神,分析问题时要独立思考批判精神,1.0
C_948209,创造性思维对科技创新意义重大如何培育这种思维并对其合理引导发挥最大作用也是一个重要问题,创造性思维科技创新意义重大培育这种思维合理引导发挥最大作用重要问题,1.0
C_948209,这次讲的是真的非常好了感动,讲真的非常感动,1.0
C_948209,第一,第一,1.0
C_948209,优秀啊,优秀,1.0
C_948209,系统自然观把系统作为自然界的存在形式凸显了自然界的整体性和普遍联系等特征,系统自然观系统自然界存在形式凸显自然界整体性普遍联系特征,1.0
C_948209,非线性的存在是不是就是否定了因果决定论而绝对的线性是不是就是因果关系啊,非线性存在是不是否定因果决定论绝对线性是不是因果关系,1.0
C_948209,辩证法可以帮助我们更好地认识世界也能更全面地正确认识世界,辩证法帮助更好认识世界全面正确认识世界,1.0
C_948209,目前人工智能可能带来的伦理问题主要体现在两个方面一方面一旦人工智能具备了超越机器的属性愈发类似于人的时候人类是否应当给予其一定的人权另一方面人工智能正在逐步在某些社会生产生活领域逐渐替代人类那么在生产生活中造成的过错应当如何解决针对这些情况如何基于伦理视角引导人工智能服务于人类已经成为人工智能发展必然要面对的问题,目前人工智能可能带来伦理问题主要体现两个方面人工智能具备超越机器属性愈发类似人类是否应当给予一定人权人工智能正在社会生产生活领域逐渐人类生产生活造成过错应当解决情况伦理视角引导人工智能服务人类已经成为人工智能发展必然面对问题,1.0
C_948209,人才是第一资源是富国之本兴邦大计科技强国就是人才强国要把人才资源开发放在科技创新最优先的位置聚天下英才而用之加快建设人才强国,人才第一资源富国兴邦大计科技强国人才强国人才资源开发放在科技创新优先位置聚天下英才而用加快建设人才强国,1.0
C_948209,通过对比重大发明创新与康德拉季耶夫经济周期大约50年左右出现一次科技革命推动经济的又一轮增长具体说就是几次工业革命都对经济社会发展产生了巨大推动当前第四次工业革命方兴未艾阿中哥把握机会冲冲冲,重大发明创新康德拉季耶夫经济周期大约50左右出现一次科技革命推动经济一轮增长具体几次工业革命经济社会发展产生巨大推动当前第四次工业革命方兴未艾阿中哥把握机会冲冲,1.0
C_948209,科学也是一种文化现象,科学文化现象,1.0
C_948209,科学技术是一把双刃剑,科学技术一把双刃剑,1.0
C_948209,浙师大2027打卡,浙师大2027打卡,1.0
C_948209,我们要想更好的发展和了解自然辩证法内容就必须要从具体科学技术中去吸收营养具体科学是种子自然辩证法就是大树,想更好发展了解自然辩证法内容必须具体科学技术吸收营养具体科学种子自然辩证法大树,1.0
C_948209,分析就是研究综合就是创造,分析研究综合创造,1.0
C_948209,综合国力竞争归根到底是人才竞争走创新发展之路首先要重视集聚创新人才习近平总书记指出我国要建设世界科技强国关键是要建设一支规模宏大结构合理素质优良的创新人才队伍激发各类人才创新活力和潜力党的十八大以来我们党坚持人才是创新的第一资源不断改善人才发展环境激发人才创造活力,综合国力竞争归根到底人才竞争走创新发展路重视集聚创新人才习近平总书记指出我国建设世界科技强国关键建设一支规模宏大结构合理素质优良创新人才队伍激发各类人才创新活力潜力党十八党坚持人才创新第一资源不断改善人才发展环境激发人才创造活力,1.0
C_948209,伦理道德不会故步自封会不断被刷新,伦理道德不会故步自封不断刷新,1.0
C_948209,确实,确实,1.0
C_948209,要深刻了解自然辩证法的哲学性质,深刻了解自然辩证法哲学性质,1.0
C_948209,科学是一般生产力只有与现实生产结合才能转化为现实生产力,科学生产力现实生产结合转化现实生产力,1.0
C_948209,科技人才最重要的就是创新我们一定要注意培养创新能力做创新型人才,科技人才重要创新一定注意培养创新能力创新型人才,1.0
C_948209,自然辩证法是科学是让人研究的而不是让人供奉起来膜拜的任何对人类有益的工作都离不开自然辩证法,自然辩证法科学研究供奉起来膜拜人类有益工作离不开自然辩证法,1.0
C_948209,劳动力过剩就会导致工人的失业,劳动力过剩导致工人失业,1.0
C_948209,科学为人类进一步解放了生产力推进了社会的进一步发展是人类社会进步的助力剂,科学人类进一步解放生产力推进社会进一步发展人类社会进步助力剂,1.0
C_948209,创新需要批判性思维,创新需要批判性思维,1.0
C_948209,创新发展创新驱动,创新发展创新驱动,1.0
C_948209,daka,daka,1.0
C_948209,确实受益匪浅,确实受益匪浅,1.0
C_948209,资本是以生产力的一定的现有的历史发展为前提的在这些生产力中也包括科学,资本生产力一定现有历史发展前提生产力包括科学,1.0
C_948209,自然观是人们在实践中形成的关于自然界及其与人类关系的总的观点它是人们认识和改造自然界的本体论基础和方法论前提,自然观在实践中形成自然界人类关系总观点认识改造自然界本体论基础方法论前提,1.0
C_948209,马克思主义科学技术的方法论以辨证唯物主义立场观点为基础吸取具体科学技术研究中的基本方法并对其进行概括和升华,马克思主义科学技术方法论辨证唯物主义立场观点基础吸取具体科学技术研究基本方法进行概括升华,1.0
C_948209,学习打卡,学习打卡,8.0
C_948209,说的很对唐同学的感想让我的敬佩之情犹如滔滔江水连绵不绝又犹如黄河决堤一发不可收拾看来我要好好的学习这门课程才能跟上同学们的觉悟了,唐同学感想敬佩之情犹如滔滔江水连绵不绝犹如黄河决堤一发不可收拾看来我要好好学习这门课程跟上同学觉悟,1.0
C_948209,关心人本身应该始终成为一切技术上奋斗的主要目标科技工作者应该始终明确自己的研究目标和意义对自己的成果负责,关心应该始终成为技术奋斗主要目标科技工作者应该始终明确研究目标意义成果负责,1.0
C_948209,自然辩证法是马克思主义中主要由恩格斯的自然辩证法这部著作所开创的一个广阔的研究领域构成马克思主义哲学的一个组成部分,自然辩证法马克思主义主要恩格斯自然辩证法这部著作开创广阔研究领域构成马克思主义哲学组成部分,1.0
C_948209,科学研究活动是人类生活的一个重要组成部分,科学研究活动人类生活重要组成部分,1.0
C_948209,宽广视野家国情怀创新思维原创思想缺一不可,宽广视野家国情怀创新思维原创思想缺一不可,2.0
C_948209,科技创新的关键是人才创新少年强则国强少年智则国智少年雄于地球则国雄于地球,科技创新关键人才创新少年强则国强少年智则国智少年雄于地球国雄地球,1.0
C_948209,搞科研就是要有家国情怀为国效力站在人类命运共同体的高度去奋斗学好自然辨证法很有用,搞科研有家国情怀为国效力站人类命运共同体高度奋斗学好自然辨证法有用,1.0
C_948209,我猜15分钟后将会变得热闹起来如果没有当我没说,猜15分钟变得热闹起来没有没,1.0
C_948209,自然观是对自然界的总的看法是世界观的组成部分唯物主义认为自然界是不依赖人的意识而独立存在的客观物质世界唯心主义认为自然界是精神或上帝的产物辩证唯物主义认为自然界是处在永恒运动变化发展中的物质世界自然界一切现象都是对立统一的它们在一定条件下相互转化自然界的发展是人类社会发展的前提和基础人对自然界认识的基础是人所引起的自然界的变化,自然观自然界总看法世界观组成部分唯物主义认为自然界依赖意识独立存在客观物质世界唯心主义认为自然界精神上帝产物辩证唯物主义认为自然界永恒运动变化发展物质世界自然界现象对立统一一定条件相互转化自然界发展人类社会发展前提基础自然界认识基础引起自然界变化,1.0
C_948209,创新满足价值需求科学研发基于理论的探索,创新满足价值需求科学研发理论探索,1.0
C_948209,研究生更要学习运用自然辩证法深入的思考和质疑要有批判精神马克思主义自然观的思想有很大的渊源他的核心东西需要我们牢牢掌握,研究生更要学习运用自然辩证法深入思考质疑批判精神马克思主义自然观思想很大渊源核心东西需要牢牢掌握,1.0
C_948209,认识事物我们要有系统观从系统的角度去分析才能把握整体才能清晰的认识系统的功能,认识事物系统观从系统角度分析把握整体清晰认识系统功能,1.0
C_948209,批判吸收既是自然辩证法产生的动力也是我们学习自然辩证法的指导方法,批判吸收自然辩证法产生动力学习自然辩证法指导方法,1.0
C_948209,人与自然和谐相处,人与自然和谐相处,2.0
C_948209,科学是一种人类活动是人类生活方式的重要组成部分,科学人类活动人类生活方式重要组成部分,1.0
C_948209,分析与综合是互相渗透和转化的在分析基础上综合在综合指导下分析分析与综合循环往复推动认识的深化和发展,分析综合互相渗透转化分析基础综合综合指导分析分析综合循环往复推动认识深化发展,1.0
C_948209,创新创新,创新创新,1.0
C_948209,可持续发展是科学发展观的基本要求之一生态自然观确立为可持续发展理论提供了哲学依据,持续发展科学发展观基本要求生态自然观确立持续发展理论提供哲学,1.0
C_948209,人不是凌驾于自然的人是自然的一部分人区别于其它生物的一个重要特征是意识和思维而意识和思维是需要物质作为载体的,凌驾于自然自然一部分区别生物重要特征意识思维意识思维需要物质载体,1.0
C_948209,以人与自然的总体关系为其研究对象的有两种描述先有自然后有人再有人对自然的认识和改造的路线,人与自然总体关系研究对象两种描述先有自然有人有人自然认识改造路线,2.0
C_948209,科学技术的发展不仅仅要引入外来技术还要自主创新,科学技术发展不仅仅引入外来技术自主创新,1.0
C_948209,自然辩证法并不代替各门具体科学技术的理论和实践研究而是对具体实践和行动的一般指南自然辩证法需要学习掌握和研究发展更要在具体科学技术实践中正确运用走向自觉的自然辩证法,自然辩证法代替各门具体科学技术理论实践研究具体实践行动指南自然辩证法需要学习掌握研究发展更要具体科学技术实践正确运用走向自觉自然辩证法,1.0
C_948209,你能联系到这个事件很厉害就我看来人类的生物潜能是有限的虽然在不断进化但是依旧赶不上科技所能带来的帮助与提升现代体育已经不可避免的沦为了政治斗争的附带也就不再可能是存粹的更快更高更强了,联系事件厉害看来人类生物潜能有限不断进化依旧赶不上科技带来帮助提升现代体育已经不可避免沦为政治斗争附带不再可能存粹快高强,1.0
C_948209,1895马关条约,1895马关条约,2.0
C_948209,又到了钢少气正的时候了吗,钢少气正,2.0
C_948209,穆勒五法亦称穆勒氏方法英国穆勒关于确定现象因果联系的五种归纳方法在逻辑体系一书中提出即契合法差异法契合差异并用法共变法剩余法这些方法在古代已有萌芽近代f培根在其新工具一书中进行了初步的概括和归纳最后由穆勒加以系统的整理和说明因而一般通称为穆勒五法,穆勒五法穆勒氏方法英国穆勒确定现象因果联系五种归纳方法逻辑体系一书中提出契合法差异法契合差异并用法共变法剩余法方法古代已有萌芽近代f培根新工具一书中进行初步概括归纳最后穆勒系统整理说明通称穆勒五法,2.0
C_948209,很有道理,道理,1.0
C_948209,把握科技创新特征,把握科技创新特征,1.0
C_948209,自然辩证法是马克思主义自然观和自然科学观的反映体现马克思主义哲学的世界观认识论方法论的统一是马克思主义哲学的一个组成部分,自然辩证法马克思主义自然观自然科学观反映体现马克思主义哲学世界观认识论方法论统一马克思主义哲学组成部分,1.0
C_948209,自然辩证法是马克思主义的自然观和自然科学观的反映体现马克思主义哲学的世界观认识论方法论的统一是马克思主义哲学的一个组成部分自然界本身的辩证法是通过自然科学和技术的发展日益被揭示出来的两个方面的研究密切相联不可分割,自然辩证法马克思主义自然观自然科学观反映体现马克思主义哲学世界观认识论方法论统一马克思主义哲学组成部分自然界辩证法自然科学技术发展日益揭示两个方面研究密切相联不可分割,2.0
C_948209,营造良好的环境有利于人才的成长,营造良好环境有利于人才成长,1.0
C_948209,浙师大2079报到,浙师大2079报到,2.0
C_948209,随着社会发展与科技进步我们人类已经克服了许多疾病的困扰找到许多疫情治疗的方法同时人口素质不断提升人们更加注重个人与公共卫生,社会发展科技进步人类已经克服疾病困扰找到疫情治疗方法人口素质不断提升更加注重个人公共卫生,1.0
C_948209,科技体制的改革需要在理论制度文化进行创新,科技体制改革需要理论制度文化进行创新,1.0
C_948209,针对科学技术的两面性我们应该辨证地去看待科学技术不能只看到它的利同时也应该看到它的弊端所以要求我们合理应用科学技术包括正视科学技术带来的社会影科学技术问题还需要科技自身来解决依靠科技进步保证环境质量进行技术评估社会制约的完善和增强加强国内法制与国际合作,科学技术两面性应该辨证地去看待科学技术不能看到利应该看到弊端要求合理应用科学技术包括正视科学技术带来社会影科学技术问题需要科技解决依靠科技进步保证环境质量进行技术评估社会制约完善增强加强国内法制国际合作,1.0
C_948209,浙师大2096打卡,浙师大2096打卡,1.0
C_948209,三个自然观是对马克思自然观的丰富与发展都围绕人与自然界关系的主题都为实现可持续发展和生态文明建设奠定了基础,三个自然观马克思自然观丰富发展围绕自然界关系主题实现持续发展生态文明建设奠定基础,1.0
C_948209,价值标准太重要了就基因编辑这个技术如果没了价值标准太恐怖了,价值标准太重要基因编辑技术没价值标准太恐怖,1.0
C_948209,人和自然是一个有机的整体不能强加一些外来物质尊重自然,自然有机整体不能强加外来物质尊重自然,1.0
C_948209,科学发展观就是最好的人工自然观,科学发展观最好人工自然观,1.0
C_948209,关键核心技术是国之重器,关键核心技术国重器,1.0
C_948209,看不懂的不一定是不好的赞成,看不懂一定不好赞成,1.0
C_948209,自然观与时俱进不断进化,自然观与时俱进不断进化,1.0
C_948209,在科学技术研究中批判性也是很重要的一点及要学会发散又要学会收敛思维从发散到收敛就是问题解决的过程,科学技术研究批判性重要一点及要学会发散学会收敛思维发散收敛问题解决过程,1.0
C_948209,人类对事物的认识都是从简单到复杂思维要考虑历史性和逻辑性,人类事物认识是从简单复杂思维考虑历史性逻辑性,1.0
C_948209,在新的高质量发展阶段科技创新作为中国经济的新引擎将扮演助推器和引航员的角色新的技术和应用将层出叠现将不断催生新经济新业态新消费并与传统产业有机融合在创造美好生活的同时也为基金投资带来无限可能,新高质量发展阶段科技创新中国经济新引擎扮演助推器引航员角色新技术应用将层出叠现不断催生新经济新业态新消费传统产业有机融合创造美好生活基金投资带来无限可能,1.0
C_948209,自然观是历史的自然观,自然观历史自然观,1.0
C_948209,劳动生产力是随着科学和技术的不断进步而不断发展的,劳动生产力科学技术不断进步不断发展,1.0
C_948209,实事求是不自以为是,实事求是自以为是,1.0
C_948209,总结的很全面好好好,总结全面好好,1.0
C_948209,马克思主义自然观为实现可持续发展和生态文明建设奠定理论基础,马克思主义自然观实现持续发展生态文明建设奠定理论基础,1.0
C_948209,马克思唯物主义自然观是自然观的高级形态是马克思主义自然观的核心,马克思唯物主义自然观自然观高级形态马克思主义自然观核心,4.0
C_948209,我珂说什么都对,珂,1.0
C_948209,科学技术通过对要素结构的影响转化为生产力,科学技术要素结构影响转化生产力,1.0
C_948209,自然辩证法是科学的理论,自然辩证法科学理论,1.0
C_948209,科技不仅求真还要求善,科技求真要求善,1.0
C_948209,在未来科技对于一个国家而言是必不可失的领域作为国家的知识分子我们理应承担起科技复兴的重任,未来科技国家必不可失领域国家知识分子理应承担科技复兴重任,1.0
C_948209,科学是一个复杂的自组织系统处在复杂的社会实践和文化的环境之中并与环境有着复杂的联系,科学复杂组织系统复杂社会实践文化环境之中环境有着复杂联系,2.0
C_948209,科学技术引领经济的发展经济的发展带动科学技术的发展二者相辅相成共同促进,科学技术引领经济发展经济发展带动科学技术发展二者相辅相成共同促进,1.0
C_948209,科学技术研究的创新除了表现为运用规范性的辩证思维形式之外还体现为收敛性与发散性逻辑性与非逻辑性抽象性和形象性的对立统一等辩证思维特征,科学技术研究创新表现运用规范性辩证思维形式之外体现收敛性发散性逻辑性与非逻辑性抽象性形象性对立统一辩证思维特征,1.0
C_948209,浙师大,浙师大,1.0
C_948209,应该针对科学技术公共决策的具体情境强调决策公共性正当性可归责性明确专家公众政府官员的角色定位打破垄断决策模式将公众作为行动者和权利人引入科学技术公共政策的制定过程形成科学民主的决策模式实现科学技术公共政策制定的民主化,应该科学技术公共决策具体情境强调决策公共性正当性归责性明确专家公众政府官员角色定位打破垄断决策模式公众行动者权利引入科学技术公共政策制定过程形成科学民主决策模式实现科学技术公共政策制定民主化,1.0
C_948209,同问,同问,2.0
C_948209,自然观是人类认识世界和改造世界的前提随着社会和科学技术的发展这种认识是在不断发展和深化的,自然观人类认识世界改造世界前提社会科学技术发展这种认识不断发展深化,1.0
C_948209,科学技术是第一生产力要实现中华民族伟大复兴必须牢牢坚持发展科技坚持进行创新坚持发展教育坚持培养创新型人才,科学技术第一生产力实现中华民族伟大复兴必须牢牢坚持发展科技坚持进行创新坚持发展教育坚持培养创新型人才,1.0
C_948209,中介系统工具是个好东西啊,中介系统工具东西,1.0
C_948209,浙师大1087打卡,浙师大1087打卡,1.0
C_948209,环境保护问题真的很重要不仅仅是雾霾水污染之类表象它更是经济问题和社会问题必须正确理解绿水青山就是金山银山的讲话正视问题面对问题才能解决问题,环境保护问题真的重要不仅仅雾霾水污染表象更是经济问题社会问题必须正确理解绿水青山金山银山讲话正视问题面对问题解决问题,1.0
C_948209,新一代的我们要努力获得原创思想,新一代努力获得原创思想,1.0
C_948209,科学是永无止尽的没有前进就是后退,科学永无止尽没有前进后退,1.0
C_948209,把服务器扩容吧不如mook好用,服务器扩容mook好用,1.0
C_948209,纵向上是飞跃和渐进横向上是分化和综合,纵向飞跃渐进横向分化综合,2.0
C_948209,马克思主义自然观形成的思想渊源主要是朴素唯物主义自然观和机械唯物主义自然观,马克思主义自然观形成思想渊源主要朴素唯物主义自然观机械唯物主义自然观,1.0
C_948209,唯物亦不是绝对的也是在探索中发展,唯物绝对探索发展,1.0
C_948209,我们要依靠科技才能够站的稳才能够提高生产力科学技术的创新发展不能走其他国家的老路要有批判有借鉴的学在科技创新上更需要自力更生,依靠科技能够站稳才能够提高生产力科学技术创新发展不能走国家老路批判借鉴学科技创新需要自力更生,1.0
C_948209,科技是经济转型与进步的基础,科技经济转型进步基础,1.0
C_948209,科学发展模式的构建是以对科学知识整体结构科学活动结构和科学理论结构的定量分析或逻辑分析为基本前提的,科学发展模式构建科学知识整体结构科学活动结构科学理论结构定量分析逻辑分析基本前提,1.0
C_948209,科学技术推动社会发展同时也验证了社会主义的合理性,科学技术推动社会发展验证社会主义合理性,1.0
C_948209,自然辩证法是马克思主义的自然观和自然科学观的反映体现马克思主义哲学的世界观认识论方法论的统一是马克思主义哲学的一个组成部分自然界本身的辩证法是通过自然科学和技术的发展日益被揭示出来的两个方面的研究密切相联不可分割的,自然辩证法马克思主义自然观自然科学观反映体现马克思主义哲学世界观认识论方法论统一马克思主义哲学组成部分自然界辩证法自然科学技术发展日益揭示两个方面研究密切相联不可分割,1.0
C_948209,自然辩证法打卡,自然辩证法打卡,1.0
C_948209,科学的发展都遵循s曲线发展规律都经历一个由加速趋向饱和的过程但是不是意味着科学发展到饱和之后就达到了发展的天花板而停滞不前科学发展在达到一次饱和之后必将迎来科学革命之后再次进入发展s型曲线如此不断的向前推进发展,科学发展s曲线发展规律经历加速趋向饱和过程意味着科学发展饱和之后达到发展天花板停滞不前科学发展达到一次饱和之后必将迎来科学革命之后再次进入发展s型曲线不断向前推进发展,1.0
C_948209,宽广视野家国情怀创新思维原创思想,宽广视野家国情怀创新思维原创思想,1.0
C_948209,思考是人的独特能力可贵之处,思考独特能力可贵处,1.0
C_948209,签到打卡,签到打卡,1.0
