course_id,text,filtered_text,count
C_948114,以下分别为客船和货船客船是专门运送旅客及其携带行李的船舶对同时运送旅客和少量货物的船舶也称客货船由于客船多为定期班轮所以又称客班船在航空运输广为发展之前国际间的邮政业务主要靠远洋客船承担故又称其为油船客船用于运送旅客及其行李和邮件的船舶对兼运少量货物的客船也称客货船客船多为定期定线航行固又称为班轮或邮轮根据solas公约规定凡载客超过12人均视为客船客船的特点是具有多层甲板的上层建筑设有完善的餐厅卫生和娱乐设施另配有足够的救生设备消防设备和通信设备货船是运载货物的船舶统称货船上除了供船员住宿活动和装有各种设备的舱室外大部分舱室均为货舱货船以载运货物为主的轮船载客12人以下的船舶其大部分舱位用于堆贮货物的货舱货船的船型很多大小悬殊排水量可从数百吨至数十万吨驳船本身无自航能力需拖船拖带的货船其特点为设备简单吃水浅载货量大驳船一般为非机动船与拖船或顶推船组成驳船船队可航行于狭窄水道和浅水航道并可根据货物运输要求而随时编组适合内河各港口之间的货物运输少数增设了推进装置的驳船称为机动驳船机动驳船具有一定的自航能力滚装船又称开上开下船或称滚上滚下船它是利用运货车辆来载运货物的专用船舶用牵引车牵引载有箱货或其他件货的半挂车或轮式托盘直接进出货舱装卸的运输船舶油轮运散装石油或成品油的液货运输船舶从广义上讲是指散装运输各种油类的船除了运输石油外装运石油的成品油各种动植物油液态的天然气和石油气等但是通常所称的油船多数是指运输原油的船而装运成品油的船称为成品油船装运液态的天然气和石油气的船称为液化气体船,运送 携带 运送 承担 用于 运送 兼运 称为 超过 视为 具有 设有 完善 配有 足够 运载 统称 供 为主 用于 堆 贮 悬殊 无自 需 简单 吃水 浅 组成 狭窄 要求 适合 增设 推进 称为 具有 开上 开 下船 称 下船 牵引 托盘 进出 装卸 散装 讲 散装 称 称为 称为,1.0
C_948114,液压系统的作用为通过改变压强增大作用力一个完整的液压系统由五个部分组成即动力元件执行元件控制元件辅助元件附件和液压油今天我想介绍的是液压钳液压钳由油箱动力机构换向阀卸压阀泵油机构组成泵油机构由油泵体高低压油出油孔偏心轴偏心轴承从动齿轮和一对高压油泵以及一低压油泵构成油泵体悬固于油箱盖上高低压油出油孔开设在油泵体上与卸压阀油路连接偏心轴呈纵向设置上端枢置于油泵体中央下端固设偏心轴承从动齿轮固置在偏心轴顶部与动力机构联结高低压油泵悬固在油泵体上各具一与偏心轴承相触的作动件高低压油泵的泵腔分别与高低压油出油孔相通将泵油机构与动力机构的连接为垂直连接可充分利用空间而小化占地面积有利于作业及运输将高低压油泵的泵油形式变为偏心轴承的作动形式具有结构简单零部件少利于装配的优点,作用 改变 压强 增大 完整 组成 执行 想 介绍 卸 组成 出 低压 构成 体悬 出 开设 卸 连接 呈 纵向 置于 联结 悬固 具 相触 出 相通 连接 垂直 连接 有利于 变为 作动 具有 简单 少 利于 装配,1.0
C_948114,数字化网络化智能化日益成为未来轮机发展的主要趋势世界主要国家纷纷加快智能轮机建设步伐轮机要想更好的发展应当攻克智能制造关键共性技术和短板装备突破船舶智能关键共性技术研制关键环节智能短板装备夯实船舶智能基础将推进基础管控精细化数字化推进并掌握全三维数字化设计包括推进基于模型的数字化设计体系建设推进船舶产品数据管理信息化,数字化网络化智能化日益成为未来轮机发展主要趋势世界主要国家纷纷加快智能轮机建设步伐轮机想更好发展应当攻克智能制造关键共性技术短板装备突破船舶智能关键共性技术研制关键环节智能短板装备夯实船舶智能基础推进基础管控精细化数字化推进掌握全三维数字化设计包括推进模型数字化设计体系建设推进船舶产品数据管理信息化,1.0
C_948114,建设海洋强国是中国特色社会主义事业的重要组成部分中共十八大报告提出提高海洋资源开发能力发展海洋经济保护海洋生态环境坚决维护国家海洋权益建设海洋强国十八大代表国家海洋局局长刘赐贵就此接受新华社记者专访解读报告首提海洋强国的意义阐述国家海洋局在建设海洋强国战略上的具体部署习近平同志在党的十九大报告中指出坚持陆海统筹加快建设海洋强国轮机应该如何发展才能更好地服务于海洋强国交通强国建设我认为有以下几点1强化学生海洋意识深刻认识建设海洋强国是中国特色社会主义事业的重要组成部分海洋事业关系民族生存发展状态关系国家兴衰安危从战略高度认识海洋强国的重要性紧迫性深刻认识海洋在国家经济发展全局中的重要战略地位自觉将狭隘的陆域国土空间思想转变为海陆一体空间思想单一的海洋产业思想转变为开放多元的大海洋经济思维使海洋国土观念深植于全体公民尤其是各级决策者的意识之中使海洋经济成为推动国民经济发展的重要引擎2要强化轮机的科学研究以技术创新为先导提升海洋基础性前瞻性关键性技术研究与转化能力加强深海生物基因研究提高海洋探测技术研究水平加强海洋防灾减灾技术攻关提高海洋预报的精度和水平建设常态化的海洋综合调查保障机制不断丰富和更新海洋基础数据和资料要强化海洋专门人才的培养面向建设海洋强国对各类人才的紧迫需求重点抓好海洋科技创新人才海洋产业经营管理人才海洋基础研究人才的培养加快海洋高等教育和职业技术教育发展壮大海洋人才队伍优化海洋人才结构3加强船舶防污染设备的监管科学合理地开发利用海洋发展壮大海洋经济是人类文明进步的重要标志也是实现海洋资源环境可持续发展的必然要求要强化规划和区划的引领作用坚持陆海统筹完善全国和省级海洋功能区划体系做好海洋事业发展规划海洋经济规划海岛保护规划同其他规划区划的衔接与配合,重要 提出 提高 开发 保护 维护 接受 专访 解读 提 阐述 具体 指出 坚持 统筹 加快 应该 认为 强化 认识 重要 生存 兴衰 认识 认识 重要 狭隘 转变 转变 开放 深植 成为 推动 重要 强化 提升 转化 加强 提高 探测 加强 攻关 提高 强化 需求 抓好 创新 加快 加强 防污染 重要 实现 要求 强化 引领 作用 坚持 统筹 完善 做好 保护 衔接 配合,1.0
C_948114,液压翻斗车是一种特殊的料斗可倾翻的短途输送物料的车辆车身上安装有一个斗状容器可以翻转以方便卸货适用于砂石土方煤炭矿石等各种散装物料的短途运输动力强劲通常有机械回斗功能,液压翻斗车特殊料斗可倾翻短途输送物料车辆车身上安装斗状容器翻转方便卸货适用砂石土方煤炭矿石散装物料短途运输动力强劲通常机械回斗功能,1.0
C_948114,液压千斤顶液压千斤顶是指采用柱塞或液压缸作为刚性顶举件的千斤顶具有结构紧凑工作平稳顶撑力大可自锁等特点液压千斤顶的撑顶能力强重型液压千斤顶顶撑力超过100t液压千斤顶分为通用液压千斤顶专用液压千斤顶通用液压千斤顶适用于起重高度不大的各种起重作业它由油室油泵储油腔活塞摇把油阀等主要部分组成工作时只要往复扳动摇把使手动油泵不断向油缸内压油由于油缸内油压的不断增高就迫使活塞及活塞上面的重物一起向上运动打开回油阀油缸内的高压油便流回储油腔于是重物与活塞也就一起下落专用液压千斤顶是专用的张拉机具在制作预应力混凝土构件时对预应力钢筋施加张力专用液压千斤顶多为双作用式常用的有穿心式和锥锚式两种,采用 顶 具有 平稳 撑 顶 强 超过 分为 通用 通用 适用 起重 大 起重 摇 组成 扳动 摇手 动 增高 迫使 打开 回 流回 下落 施加 作用 穿 锥,1.0
C_948114,通过这次课程的学习我对轮机和机舱的了解较以往更加细致深入了虽然仍然只是一些简化过的内容但还是让我对轮机和机舱有了崭新的认知从船舶的一些参数开始到各种设备再到最后的相关的法律规定我不但对轮机本身的一些原理有了更加系统却也感性的认知也将轮机与现实接轨开拓了国际视野同时老师们风趣幽默明了易懂的讲述也让我感触颇多受益匪浅让轮机和机舱对于我来说不再抽象和陌生轮机的作用在船舶中必不可少是船舶的心脏它是为了满足船舶航行各种作业人员的生活人员和财产安全等各种需要所设置的全部系统及其设备的总称一切都离不开它机舱则给这些设备以存放的地点大家排布合理和谐彼此配合使船上的一切活动井井有条,学习 了解 细致 深入 简化 认知 相关 认知 接轨 开拓 幽默 明 讲述 感触 抽象 作用 满足 需要 离不开 存放 排布 和谐 配合,1.0
C_948114,海洋强国的概念则是建立在海洋大国之上的从海洋大国到海洋强国是漫长且重要的过程在当今复杂多变的全球局势背景下单单做一个海洋大国是远远不够的辽宁舰的服役展示了我国保卫海防和努力成为海洋强国的坚定决心那么这一切的意义又是什么呢首先强大的海洋军事实力是保护我国海洋资源不受掠夺的根本保证俗话说得好打铁还需自身硬一个国家如果没有足够强大的军事实力来保卫海防那么有再多的海洋资源都不可能稳定安全地进行开发利用所以要求我们要注重创新其次应该注重培养轮机方面的人员再次应该不断完善体系如向智能化方向改进,建立 重要 单单 展示 保卫 成为 坚定 决心 强大 保护 受 掠夺 打铁 需 硬 没有 足够 强大 保卫 可能 稳定 进行 要求 注重 创新 应该 注重 培养 应该 如 改进,1.0
C_948114,自动翻斗车,自动翻斗车,1.0
C_948114,游艇是一种水上娱乐用高级耐用消费品它集航海运动娱乐休闲等功能于一体满足个人及家庭享受生活的需要在发达国家游艇像轿车一样多为私人拥有,游艇水上娱乐高级耐用消费品它集航海运动娱乐休闲功能一体满足个人家庭享受生活需要发达国家游艇轿车多为私人拥有,1.0
C_948114,液压缸是将液压能转变为机械能的做直线往复运动或摆动运动的液压执行元件它结构简单工作可靠用它来实现往复运动时可免去减速装置并且没有传动间隙运动平稳因此在各种机械的液压系统中得到广泛应用液压缸输出力和活塞有效面积及其两边的压差成正比液压缸基本上由缸筒和缸盖活塞和活塞杆密封装置缓冲装置与排气装置组成缓冲装置与排气装置视具体应用场合而定其他装置则必不可少,液压缸液压转变机械能直线往复运动摆动运动液压执行元件结构简单工作可靠实现往复运动免去减速装置没有传动间隙运动平稳机械液压系统得到广泛应用液压缸输出力活塞有效面积两边压差成正比液压缸基本上缸筒缸盖活塞活塞杆密封装置缓冲装置排气装置组成缓冲装置排气装置视具体应用场合而定装置必不可少,1.0
C_948114,在中共中央政治局第八次集体学习时习近平主席强调21世纪人类进入了大规模开发利用海洋的时期海洋在国家经济发展格局和对外开放中的作用更加重要在维护国家主权安全发展利益中的地位更加突出在国家生态文明建设中的角色更加显著在国际政治经济军事科技竞争中的战略地位也明显上升我国是一个陆海兼备的发展中大国建设海洋强国是全面建设社会主义现代化强国的重要组成部分建设海洋强国意义非凡是完全必要的非常及时的维护海权必需有强大的海军作支撑大规模开发利用海洋必需具备必要的经济技术能力没有这个支撑和技术能力一切都是空谈今天党中央提出了建设海洋强国的目标说明我们已经初步具备了这种能力我们的战略目标是从浅海进入深海从领海专属经济区大陆架走向公海国际海底区域和两极借以扩大中国生存发展和安全空间总之中国已经是陆海兼备的海洋大国实现从陆权国家向海权国家的转变从海洋大国向海洋强国的转变这是中国的核心利益所在其现实意义与战略意义都十分巨大而深远,学习 强调 进入 作用 重要 维护 突出 显著 明显 上升 兼备 重要 维护 必需 强大 作 支撑 必需 具备 没有支撑 空谈 提出 说明 具备 是从 进入 走向 借以 扩大 生存 兼备 实现 转变 转变 是 巨大 深远,1.0
C_948114,工程机械液压系统是由液压油箱液压泵装置及液压控制装置三大部分组成液压油箱装有空气滤清器滤油器液面指示器和清洗孔等液压泵装置包括不同同类型的液压泵驱动电机及其它们之间的联轴器等液压控制装置是指组成液压系统的各阀类元件及其联接体,工程机械液压系统液压油箱液压泵装置液压控制装置大部分组成液压油箱装有空气滤清器滤油器液面指示器清洗孔液压泵装置包括不同类型液压泵驱动电机之间联轴器液压控制装置指组成液压系统各阀类元件联接体,1.0
C_948114,军舰图中列举的航母属于水面战斗舰艇是在海上执行战斗任务的船舶担当着维护国家海洋权益守卫还上边境线保护我国海外利益的重要作用一个国家军舰的建造技术水平一定程度上代表了整个国家队科学技术水平在世界贸易日渐发达的今天军舰的地位也变得越来越重要各个国家的海上贸易都需要军舰去保护,军舰图中列举航母属于水面战斗舰艇海上执行战斗任务船舶担当维护国家海洋权益守卫边境线保护我国海外利益重要作用国家军舰建造技术水平一定程度代表整个国家队科学技术水平世界贸易日渐发达今天军舰地位变得越来越重要国家海上贸易需要军舰保护,1.0
C_948114,滚装船是运载滚动车辆的运输船如运载各种汽车装满集装箱或货物的卡车和挂车等滚装船以装满集装箱或货物的车辆为运输单元装载时汽车及由牵引车辆拖带的挂车通过跳板开进舱内到达目的港后车辆可直接开往收货单位滚装船的装卸效率很高每小时可达10002000吨而且实现了从发货单位到收货单位的门门直接运输减少了运输过程中的货损和差错此外船与岸都不需起重设备即使港口设备条件很差滚装船也能高效率装卸,滚装船运载滚动车辆运输船运载汽车装满集装箱货物卡车挂车滚装船装满集装箱货物车辆运输单元装载汽车牵引车辆拖带挂车跳板开进舱内到达目的港车辆直接开往收货单位滚装船装卸效率高小时可达10002000吨实现发货单位收货单位门门直接运输减少运输过程货损差错船岸需起重设备港口设备条件很差滚装船高效率装卸,1.0
C_948114,建设海洋强国是中国特色社会主义事业的重要组成部分习近平同志在党的十九大报告中指出坚持陆海统筹加快建设海洋强国21世纪人类进入了大规模开发利用海洋的时期海洋在国家经济发展格局和对外开放中的作用更加重要在维护国家主权安全发展利益中的地位更加突出在国家生态文明建设中的角色更加显著在国际政治经济军事科技竞争中的战略地位也明显上升面对日益加大的挑战轮机部门首先要完成技术的革新用更加先进的硬件水平迎接挑战此外还要不断完善软件措施用更有效的治理方式协助硬件,重要 指出 坚持 统筹 加快 进入 作用 重要 维护 突出 显著 明显 上升 面对 加大 完成 先进 有效 治理 协助,1.0
C_948114,机舱集控室也是轮机员工作的场所集控室主要由主控台和配电板组成主控台控制着主副机和发电机的启动关闭并通过报警系统对整个机舱工况进行监控配电板通俗来讲就是变压器的控制面板和机舱各类泵浦的启动面板通常机舱发生报警后轮机员能够迅速通过控制面板判断故障原因然后到现场进行处理,机舱集控室轮机员工作场所集控室主要主控台配电板组成主控台控制主副机发电机启动关闭报警系统对整个机舱工况进行监控配电板通俗来讲变压器控制面板机舱各类泵浦启动面板通常机舱发生报警轮机员能够迅速控制面板判断故障原因现场进行处理,1.0
C_948114,人类进入了大规模开发利用海洋的时期海洋在国家经济发展格局和对外开放中的作用更加重要在维护国家主权安全发展利益中的地位更加突出在国家生态文明建设中的角色更加显著在国际政治经济军事科技竞争中的战略地位也明显上升未来我国经济发展将坚持质量第一效益优先以供给侧结构性改革为主线推动经济发展质量变革效率变革动力变革在推动形成全面开放新格局中以一带一路建设为重点坚持引进来和走出去并重形成陆海内外联动东西双向互济的开放格局新时代对我国水运发展提出了新要求新时代要求水运进一步提升服务保障能力提升国际影响力支撑现代化强国建设为世界经济发展作出积极贡献进一步完善全球航运服务网络布局有效支撑一带一路建设助力人类命运共同体建设,进入 作用 重要 维护 突出 显著 明显 上升 坚持 侧 为主 推动 推动 形成 开放 坚持 引进 走 出去 并重 形成 联动 开放 新 提出 新 要求 新 要求 提升 保障 提升 支撑 作出 完善 有效 支撑,1.0
C_948114,通过对本课程的学习我了解到船舶轮机的基本内容船舶轮机就是为了满足船舶航行各种作业人员的生活人员和财产的安全需要所设置的全部机械设备和系统的总称具体包括船舶动力装置辅助动力装置舵机和其他设备船舶动力装置主要由推进装置辅助动力装置管路系统甲板机械防污染设备应急设备和自动化设备七部分组成按照主机所用的燃料性质以及工作方式的不同船舶动力装置的类型可以分为柴油机动力装置蒸汽动力装置燃气轮机动力装置核动力装置其中柴油机动力装置在现代船舶中使用最为广泛船舶辅助动力装置是用于提供除推进装置以外的各种能量供船舶航行作业和生活需要的装置包括为全船提供电力照明和其他动力的装置如船舶电站副锅炉等舵机就是用于控制和操纵舵叶偏转的重要机械设备船舶安全顺利地航行并且迅速地到达目的地或预定的泊位除依靠主机的推进外还必须具有良好的操纵性能即按驾驶人员意图保持或改变航向的能力其他装置包括船舶起货机锚机和缆设备等等,学习 了解 满足 需要 具体 包括 推进 防污染 组成 不同 分为 使用 广泛 用于 提供 推进 供 需要 包括 提供 照明 用于 控制 操纵 偏转 重要 到达 预定 依靠 推进 具有 良好 操纵 保持 改变 包括,1.0
C_948114,面向新时代中国航海事业和海洋产业正迎来前所未有的历史发展机遇在船舶智能化无人化的背景下为实现海洋强国交通强国的建设目标我国应当积极开展智能航运架构体系研究制定智能航运发展战略编制国家智能航运中长期发展规划和阶段性行动计划提高港口航道船闸等基础设施与智能船舶自主航行靠离码头自动化装卸货的配套衔接水平开展相关关键技术研究与工程实践适时发布智能船舶技术应用和产品推广目录引导和鼓励现有船舶通过改造或直接应用成熟的智能船舶技术与产品,新 迎来 实现 应当 制定 编制 提高 自主 靠离 装卸 配套 衔接 开展 相关 实践 发布 应用 推广 引导 鼓励 改造 应用 成熟,1.0
C_948114,通过本课程的学习我们得以了解到船舶机舱的一些基础知识轮机是为了满足船舶航行各种作业人员生活人员和财产安全等各种需要所设置的全部系统及其设备的总称根据组成传播轮机的各种系统机械和设备所起作用的不同可以将其分为推进装置辅助装置管路系统甲板机械防污染设备特种系统六个部分推进装置是船舶动力装置中最重要的组成部分包括主机传动设备和推进器等其作用是将主机发出功率通过传动设备传递给推进器从而推动船舶航行辅助装置是产生除推进装置所需能量以外的其他各种能量的装置包括船舶电站辅助锅炉压缩空气系统以及为船员和旅客生活服务的设备和系统管路系统是船舶为了完成一定任务专门用来输送和排出液体或气体的管路机械设备和检测仪表等的总称分为动力系统管系和辅助系统管系甲板机械是装在船舶甲板上的机械设备是船舶的重要组成部分甲板机械是为了保证船舶正常航行及船舶停靠码头装卸货物上下旅客所需要的机械设备和装置船舶甲板机械可以分为大甲板机械和小甲板机械主要包括舵机起锚机和绞车导缆器带缆桩系揽桩导缆滚轮等等防污染设备是指为防止船舶污染海洋和大气环境而设置的设备主要包括油水分离器生活污水处理装置焚烧炉压载水处理装置和柴油机尾气处理装置等特种系统是为特种船舶而设计装备的系统如油船专用系统复式储油船的端点系泊系统挖泥船的泥浆抽吸系统等,学习 得以 了解 满足 需要 组成 所起 作用 不同 分为 推进 防污染 推进 重要 包括 作用 发出 传递 推动 推进 需 包括 完成 输送 排出 分为 装 重要 保证 停靠 需要 分为 包括 带 系 揽 防污染 防止 包括 压载 处理 处理 抽吸,1.0
C_948114,通过对本门课程的学习我对轮机机舱的组成构造用途有了一定的了解和认识轮机是为满足船舶航行各种作业人员的生活财产和人员的安全所需要设置的全部机械设备和系统的总称轮机又被称作船舶动力装置轮机由推进装置辅助装置管路系统甲板机械防污染设备自动化设备特种设备及系统组成船舶推进装置由推进器轴系传动设备主机组成主机用于提供船舶航行所需要的机械能推进器用来把主机输出的机械能转换为推力从而推动船舶前进或后退辅助装置是除推进装置外其他能产生能量的设备如产生电能的船舶电站发电机组产生热能蒸汽的辅锅炉产生压力能的液压泵站和空气压缩机管路系统连接各种机械设备输送相关流体分为动力系统和辅助系统甲板机械一般布置在机舱之外由甲板部人员操作分为传统甲板机械和特种甲板机械传统甲板机械是控制船舶航向的舵机使船舶停泊的锚机绞缆机装卸货物用的起货机特种甲板机械有提供船舶侧推力的侧推器和减轻船舶横摇的减摇鳍防污染设备用于防止船舶造成海洋和大气污染分为三大传统的防污染设备和新的防污染设备三大传统防污染设备有油水分离器生活污水处理装置焚烧炉新的防污染设备有压载水处理装置和柴油机废气后处理装置自动化设备是外加在机械设备上的用于改善船员工作条件减轻劳动强度提高工作效率减少人为失误主要包括遥控自动调节监控报警参数记录与打印特种设备是为某位特殊作业而设计的设备及系统如挖泥船的泥浆抽吸系统和某些工程作业船舶的动力定位系统,学习 组成 构造 了解 认识 满足 需要 推进 防污染 组成 推进 组成 用于 提供 需要 输出 转换 推力 推动 前进 后退 推进 站 连接 输送 相关 分为 操作 分为 控制 停泊 提供 侧 推力 侧 减轻 横摇 防污染 用于 防止 造成 分为 防污染 新 防污染 防污染 新 防污染 压载 处理 外加 用于 改善 减轻 提高 减少 包括 打印 特殊 抽吸,1.0
C_948114,从原理上来说液压传动所基于的最基本的原理就是帕斯卡定律也就是说液体各处的压强是一致的这样在平衡的系统中比较小的活塞上面施加的压力比较小而大的活塞上施加的压力也比较大这样能够保持液体的静止所以通过液体的传递可以得到不同端上不同的压力就可以达到一个变换的目的人们所常见到的液压千斤顶就是利用了这个原理来达到力的传递,原理液压传动基本原理帕斯卡定律也就是说液体各处压强一致平衡系统比较活塞上面施加压力比较小而大活塞施加压力比较能够保持液体静止液体传递得到不同端不同压力达到变换目的常见液压千斤顶利用原理达到力传递,1.0
